image_id,caption,text_id,new_image_id,new_caption
Image14001005-5943.jpg,地方站>正文> 北京冬奥会会徽雕塑.,741,140010055943,北京冬奥会会徽雕塑 地方站 正文 
Image14001005-5947.jpg,"雨中零落的石榴花,一地残花,看着心碎",742,140010055947,地残花 石榴花 雨 
Image14001005-5952.jpg,h3c数据中心方案设计及设备选型比赛,743,140010055952,h3c数据中心方案设计 比赛 设备 
Image14001005-6093.jpg,"搞笑 正文  在澡堂相遇的两个萝卜: 笑口常开,好运自来!",744,140010056093,好运自来 笑口 萝卜 
Image14001005-6098.jpg,"位列第四位的就是罗家枪法,代表人物是湖广<人名>,他是这四个人里面",745,140010056098,罗家枪法 湖 人物 
Image14001005-6128.jpg,厂家直销 专业定做 高精度减速器输出轴 洗衣机减速机,746,140010056128,高精度减速器 洗衣机 厂家 
Image14001005-6157.jpg,"四大模式 | 招行乐视掐架,和""内保外贷""有啥关系?",747,140010056157,招行乐视 大模式 架 
Image14001005-6249.jpg,宁夏2021高考本科第二批院校投档线(理科)|太原师范,748,140010056249,院校投档线 太原师范 高考本科 
Image14001005-6304.jpg,7种美容方法让你亮丽动人 橄榄油的美容方法 - 民福康,749,140010056304,美容方法 橄榄油 民福康 
Image14001005-6322.jpg,国内有哪些知名的智能家居品牌?,750,140010056322,智能家居品牌 
Image14001005-6327.jpg,"世界政坛就是这么有意思.最近,德国总理去俄罗斯访问了.",751,140010056327,世界政坛 德国总理 俄罗斯 
Image14001005-6335.jpg,"1982年不过,真正的转折发生在直到50多岁依旧没有实现主演梦.",752,140010056335,转折 梦 
Image14001005-6394.jpg,什么是新工艺白茶与做旧茶一文带你理清关系今后不怕买错茶,753,140010056394,旧茶 清关系 新工艺白茶 
Image14001005-6456.jpg,"<人名>战败后连发数条微博怒斥熊呈呈,熊在撒谎要不是",754,140010056456,熊 微博 
Image14001005-6487.jpg,"老鸭柿种2年了,还没开过花,这是为什么?买桩种的",755,140010056487,老鸭柿 桩种 花 
Image14001005-6559.jpg,"分析了美国著名大公司的丑闻,裁员,重组,近期财务状况和其他主要的",756,140010056559,财务状况 美国著名大公司 裁员 
Image14001005-6585.jpg,九略—东湖高新—项目计划和总结2.doc 1页,757,140010056585,东湖高新 项目计划 2.doc 
Image14001005-6737.jpg,《中国烹饪》封面<人名><人名>刘毅姜习<人名>郑友梅<人名><人名>李淑,758,140010056737,中国烹饪 刘毅姜习 郑友梅 李淑 
Image14001005-6813.jpg,提车半个月心得,759,140010056813,提车半个月心得
Image14001005-6817.jpg,万众瞩目!隆盛地产御字系高端首作揭晓!,760,140010056817,隆盛地产御字系高端首 揭晓 
Image14001005-6877.jpg,外婆是一个通达且明事理的老人 在华莉丝赤脚逃婚穿越沙漠来到她的,761,140010056877,华莉丝赤脚 外婆 事理 
Image14001005-7013.jpg,"下面要讲的东西,跟我们上篇所写的安徽,刚好是紧密相关的.",762,140010057013,安徽 东西 
Image14001005-7025.jpg,鬼谷子正版书原著无删减捭阖七十二术本经阴符七术与攻心术鬼谷子,763,140010057025,删减捭阖 鬼谷子正版书原著 七术与攻心术鬼谷子 
Image14001005-7056.jpg,"最左边的<人名>,大概是那个时候跟<人名>有了交集,直到之前一组她和",764,140010057056,交集 
Image14001005-7128.jpg,单票 票 票据 640_743,765,140010057128,单票 票据 票 
Image14001005-7348.jpg,韩国yg公司老板<人名>告记者损毁名誉 索赔2亿韩元,766,140010057348,韩国yg公司老板 名誉 记者 
Image14001005-7414.jpg,陆风x6 2007款 新饰力 2.8l 四驱标准,767,140010057414,四驱标准 陆风x6 新饰力 
Image14001005-7455.jpg,"去公园,野生动物园,郊外等地方游玩时,应特别注意不要接触野生禽鸟",768,140010057455,野生动物园 野生禽鸟 公园 
Image14001005-7664.jpg,经典高端共赢未来古风禅意佛本是道ppt模版,769,140010057664,道ppt模版 经典高端 古风禅意佛本 
Image14001005-7745.jpg,「百年盛世·大家风范」著名画家<人名>作品展 - 藏艺,770,140010057745,著名画家 藏艺 作品展 
Image14001005-7788.jpg,上海书画出版社 - 书问,771,140010057788,上海书画出版社 - 书问
Image14001005-7824.jpg,"后系统会自动生成相关数据表格,支持进行快速打印或批量导出电子表格",772,140010057824,电子表格 相关数据表格 系统 
Image14001005-7890.jpg,"产品特点,产品优势以及顾客的消费习惯进行设计出适合本身的一款纸",773,140010057890,消费习惯 产品特点 产品优势 
Image14001005-7909.jpg,张家口 赤城 南仓堡,774,140010057909,张家口 赤城 南仓堡
Image14001005-7914.jpg,连云港旅游招商推介会在日本大阪举行,775,140010057914,连云港旅游招商推介会 日本 
Image14001005-7962.jpg,最终实现公司北美区域国际航线多条航路灵活优选和北京=布鲁塞尔航线,776,140010057962,布鲁塞尔航线 公司北美区域国际航线 航路 
Image14001005-8031.jpg,全 中国当<人名>作品选一二三 -76- 上下册 庆生 又平,777,140010058031,上下册 -76 作品 
Image14001005-8073.jpg,"控制车速,保持车距,各行其道.",778,140010058073,车距 车速 
Image14001005-8125.jpg,"过去靠滚雪球的金融玩法或许很难行得通了,因为现在拿地金额必须跟卖",779,140010058125,金融玩法 地金额 
Image14001005-8140.jpg,毕节水陆战车厂,780,140010058140,毕节水陆战车厂
Image14001005-8147.jpg,"努力,坚持,自爱,沉静,提醒年轻的自己!",781,140010058147,努力 
Image14001005-8190.jpg,两人离开喀布尔后发表声明说:「美国对我国公民和忠诚盟友负有道德,782,140010058190,忠诚盟友 我国公民 喀布尔后 
Image14001005-8195.jpg,小学四年级数学上册第二单元试卷(配人教实验教材)答案,783,140010058195,年级数学 单元试卷答案 册 
Image14001005-8253.jpg,【仕】定制手工缝制固特异绅士商务男整张意大利小牛皮鞋皮底婚鞋,784,140010058253,仕 婚鞋 意大利小牛皮鞋皮 特异绅士商务 
Image14001005-8352.jpg,"纵观其股东亦多为全球顶级投资人;成立之初,其获得红杉资本等机构的",785,140010058352,红杉资本 全球顶级投资人 股东 
Image14001005-8357.jpg,用于心悸 失眠多梦】和田维吾尔 健心合米尔高滋斑安比热片 0.,786,140010058357,和田维吾尔 健心合米尔 斑安 
Image14001005-8360.jpg,"本质上讲,女人自我价值的实现是在男人对她的认可,爱慕中才能实现.",787,140010058360,男人 女人 本质 
Image14001005-8504.jpg,风情滨水商街,788,140010058504,风情滨水商街
Image14001005-8590.jpg,名家 惠维 山水 - 作品161终南山雪景,789,140010058590,终南山雪景 惠维 名家 
Image14001005-8715.jpg,"【组图】耍猴人最底层的卖艺人凭双手吃饭,却处处遭人",790,140010058715,组图 猴人 双手吃饭 卖艺人 
Image14001005-8725.jpg,这种温情的文化和生活方式每年吸引了超过百万人次的业主参与到金科,791,140010058725,生活方式 金科 业主 
Image14001005-8935.jpg,"1928年, 珂勒惠支被选为 柏林艺术学院版画部主任",792,140010058935,柏林艺术学院版画部主任 珂勒 
Image14001005-8950.jpg,"北京反恐特警总队,展现不一样的骑士风采!",793,140010058950,骑士风采 北京反恐特警总队 
Image14001005-9118.jpg,京沪二线最新消息 2019京沪二线莒县诸城最新_京沪二线山东调整,794,140010059118,沪二线山东调整 京沪二线最新消息 诸城 
Image14001005-9195.jpg,"人社部,深圳市领导等与hroot总经理<人名>共同为深圳",795,140010059195,与hroot总经理 深圳市领导 人社部 
Image14001005-9265.jpg,(巴黎) 瑞士意大利七日浓情之旅(编号:sit7),796,140010059265,浓情 瑞士意大利 旅 
Image14001005-9272.jpg,辞旧迎新的快乐,797,140010059272,辞旧迎新的快乐
Image14001005-9275.jpg,初中老师全款买房被家长举报月收入不超5000用什么买的,798,140010059275,月收入 初中老师全款 家长 
Image14001005-9311.jpg,斗罗大陆魂师对决<人名>阵容怎么搭配,799,140010059311,斗罗大陆魂师对决 阵容 
Image14001005-9343.jpg,三步走广誉远到底能走多远,800,140010059343,三步走广誉远到底能走多远
Image14001005-9432.jpg,[新车谍报]路虎改款神行者2路试谍照曝光_汽车_腾讯网,801,140010059432,路试谍照 款神行者 路虎 
Image14001005-9591.jpg,恒大影城群力店 恒大影城(群力店)入驻道里群力新区 道里区第一家,802,140010059591,恒大影城群力店 道里群力新区 道里区 
Image14001005-9719.jpg,"有多少痴情,只是因为不甘心",803,140010059719,"有多少痴情,只是因为不甘心"
Image14001005-9757.jpg,浪漫后现代风格斜顶阁楼装修效果图,804,140010059757,阁楼装修效果图 风格 
Image14001005-9765.jpg,"京城最in八家网红甜品店,你拔草了几家?",805,140010059765,京城最in 网红甜品店 草 
Image14001005-9804.jpg,"为进一步推动消费升级,北京将孵化一批新消费品牌.",806,140010059804,消费升级 新消费品牌 北京 
Image14001006-0071.jpg,""" 离开泸沽湖的那个早上我很舍不得.",807,140010060071,泸沽湖 
Image14001006-0367.jpg,"鄢颇风流了一辈子,梅婷,李小冉这样的大美女全部都被她错过了,而",808,140010060367,大美女 鄢 李小冉 
Image14001006-0514.jpg,而手动挡汽车就需要通过适时切换挡位来改变车辆速度以及发动机扭力的,809,140010060514,发动机扭力 手动挡汽车 车辆速度 
Image14001006-0532.jpg,"这座南宋小城曾让蒙古军队停止征伐,影响欧亚大陆的历史",810,140010060532,欧亚大陆 蒙古军队 小城 
Image14001006-0565.jpg,"乌总理季莫申科:""平民女孩""到""天然气公主""",811,140010060565,乌总理季莫申科 平民女孩 天然气公主 
Image14001006-0614.jpg,君山别墅3室3厅150㎡288万二手房图片,812,140010060614,君山别墅 二手房图片 室 
Image14001006-0620.jpg,"《见字如面2》成""视帝视后""顶级讲堂",813,140010060620,见字如面2 顶级讲堂 字如面 帝 
Image14001006-0730.jpg,人参五宝茶黄精桑葚枸杞熬夜身体大补调理滋补品男人养生八宝肾茶,814,140010060730,滋补品男人 宝茶黄精 八宝肾茶 
Image14001006-0776.jpg,服务留个半星算给面子了.,815,140010060776,服务留个半星算给面子了.
Image14001006-0827.jpg,"她强调,古岘镇有历史,有文化,美丽乡村建设要与特色镇打造充分结合",816,140010060827,美丽乡村建设 古岘镇 特色镇 
Image14001006-0855.jpg,"都会带来整个行业新的一波洗牌,也会带来新的行业的发展机会",817,140010060855,整个行业 发展机会 牌 
Image14001006-0884.jpg,"巴基斯坦总理伊姆兰·汗确诊,莫迪祝早日康复",818,140010060884,巴基斯坦总理伊姆兰·汗 莫迪 
Image14001006-0905.jpg,"并非蜗居那么简单 欧洲悄悄流行""睡觉箱""",819,140010060905,箱 欧洲 
Image14001006-1009.jpg,青霉素皮试,820,140010061009,青霉素皮试
Image14001006-1171.jpg,亲子阅读怎么选书?不同年龄段孩子要读的书不同,821,140010061171,不同年龄段孩子 书 亲子 
Image14001006-1194.jpg,8折开撸!,822,140010061194,8折开撸!
Image14001006-1257.jpg,"赶紧跑吧,有个谢顶的怪蜀黍拍着篮球追你来了.",823,140010061257,怪蜀黍 篮球 谢顶 
Image14001006-1359.jpg,"这是中国的本月大船集团,所交付出来的一艘,名字为凯力轮的大型油船",824,140010061359,大型油船 本月大船集团 凯力 
Image14001006-1380.jpg,"随着中国社会老龄化趋势的加深,老年教育作为终身教育不可或缺的重要",825,140010061380,终身教育 中国社会老龄化趋势 加深 
Image14001006-1390.jpg,"【二手9成新】老版中医医籍《血证论》全1册""本书为清代医学家.",826,140010061390,二手9成新 血证论 全1册 老版中医医籍 医学家 
Image14001006-1512.jpg,基于生态保护红线10自然保护区和国家公园及重要生态功能区等明确,827,140010061512,国家公园 生态保护红线 重要生态功能区 
Image14001006-1521.jpg,刘东一行详细了解 郑州十一中考点考务工作情况,828,140010061521,刘东一行 考点考务工作情况 郑州 
Image14001006-1573.jpg,swm斯威x7正是精准地切合了这一用户需,829,140010061573,swm斯威x7 用户 
Image14001006-1681.jpg,"语文的基础选择题和默写题,功夫在平时,靠临时抱佛脚很难获得考前",830,140010061681,语文 默写题 临时抱佛脚 
Image14001006-1714.jpg,信用评级aa还打造了贵州本土的网约车平台这家企业厉害了,831,140010061714,信用评级aa 网约车平台 贵州本土 
Image14001006-1770.jpg,王者荣耀 圣斗士不仅可以联动后羿出皮肤 还可以联动这十个英雄,832,140010061770,圣斗士 皮肤 英雄 
Image14001006-1832.jpg,"他们就是七杀剑武魂的传承者,九十七级极限斗罗尘心,另外一个是先天",833,140010061832,剑武魂 七级极限斗罗尘心 传承者 
Image14001006-1999.jpg,新款大众途观l有望九月上市颜值小改能回到榜首,834,140010061999,新款大众途观l 上市颜值 榜首 
Image14001006-2004.jpg,"海贼王:海米们一定要看这部电影哟,老沙,斯摩格,女帝",835,140010062004,女帝 海米们 老沙 
Image14001006-2161.jpg,"葫芦是一年生的 攀援草本植物,全身布满细毛,叶片近似心形.",836,140010062161,叶片近似心形 攀援草本植物 葫芦 
Image14001006-2283.jpg,"对网络设备要有一定的可管理性,可以方便的进行远程管理. 4.",837,140010062283,远程管理 网络设备 管理性 
Image14001006-2329.jpg,"外媒:科学家首次发现神秘天体,悬浮在太阳系边缘",838,140010062329,神秘天体 太阳系边缘 外媒 
Image14001006-2540.jpg,"广东宏远大胜夜留隐患,超级小外援手腕再度受伤令人担忧!",839,140010062540,广东宏远 小外援手腕 隐患 
Image14001006-2546.jpg,"个人债务是指夫妻一方为满足个人需要所借的债务;夫妻共同债务,通常",840,140010062546,个人债务 夫妻一方 夫妻共同债务 
Image14001006-2644.jpg,"明星为拍美照太拼,杨紫躺桌子,<人名>用脚趾,我就服包",841,140010062644,美照 杨紫 脚趾 
Image14001006-2660.jpg,一元二次不等式相关的题.,842,140010062660,一元二次不等式相关的题.
Image14001006-2665.jpg,"蟹虾一锅煮,竟能如此的好吃!根本吃不够",843,140010062665,蟹虾 
Image14001006-2736.jpg,给大家表演一个美女过生日,844,140010062736,给大家表演一个美女过生日
Image14001006-2834.jpg,wtt多哈赛伊藤美诚<人名>和轻松闯关平野美宇石川佳纯出局,845,140010062834,wtt多哈赛 平野美宇石川佳纯 
Image14001006-2980.jpg,"呼伦贝尔草原,海拉尔-白桦林-驯鹿园-临江-满洲里,6日",846,140010062980,呼伦贝尔草原 白桦林 海拉尔 
Image14001006-3037.jpg,2018-12-07 举报 删除 埃及公主为争夺,847,140010063037,埃及公主 
Image14001006-3049.jpg,"恰恰现在有非常多的伙伴,选择观望,而不敢去行动,为何这一现象特别",848,140010063049,伙伴 行动 现象 
Image14001006-3197.jpg,"x线片检查结果显示,骨盆倾斜,双髋关机融合,骶髂关节融合.",849,140010063197,x线 骨盆倾斜 检查结果 
Image14001006-3237.jpg,肖战又双叒登上商业财报商务魔王一骑绝尘早已初露峥嵘,850,140010063237,商业财报商务魔王 绝尘 叒 
Image14001006-3264.jpg,"《花千骨》是由慈文传媒集团制作并发行,<人名>",851,140010063264,花千骨 慈文传媒集团 
Image14001006-3268.jpg,dnf:鬼剑士各职业专属天空套盘点 深渊恶魔配红眼毋庸,852,140010063268,深渊恶魔 红眼 职业专属天空套盘点 
Image14001006-3275.jpg,创新才能发展!,853,140010063275,创新才能发展!
Image14001006-3283.jpg,华泰人寿安心稳赢年金保险,854,140010063283,华泰人寿安心稳赢年金保险
Image14001006-3446.jpg,赵匡胤把中唐200年以来的毒瘤根除掉代价是自身性命,855,140010063446,毒瘤 性命 代价 
Image14001006-3466.jpg,"绍兴籍演员<人名>出任此次电影节亚洲新人奖单元的评委,是除了导演",856,140010063466,绍兴籍演员 电影节亚洲新人奖单元 评委 
Image14001006-3487.jpg,调浓墨画竿.,857,140010063487,调浓墨画竿.
Image14001006-3649.jpg,"白色垭口与一组嵌入式餐边柜,美观的同时增加空间的收纳机能",858,140010063649,嵌入式餐边柜 收纳机能 白色垭口 
Image14001006-3846.jpg,"师曰:尔等莫怕,知其皆冤屈之鬼,切莫再做恶毒之事,吾领其明善修德",859,140010063846,冤屈之鬼 莫怕 吾领 
Image14001006-3847.jpg,快贷网|网贷黑名单上岸攻略详解!,860,140010063847,网贷黑名单上岸攻略 网 
Image14001006-3849.jpg,"年初该去催债了!教你一招,欠款秒到账!",861,140010063849,欠款 债 招 
Image14001006-4071.jpg,地主爷的来源及祭拜吉日,862,140010064071,地主爷的来源及祭拜吉日
Image14001006-4275.jpg,忻州这里来了一群白天鹅 摄影师随手一拍留住了它们,863,140010064275,忻州 摄影师 白天鹅 
Image14001006-4338.jpg,"这里山涧秋季到处可见酸甜可口的野果,美味极了!",864,140010064338,野果 山涧 美味 
Image14001006-4501.jpg,yt-trb土壤肥料养分速测仪价格,865,140010064501,yt-trb土壤肥料养分速测仪价格 
Image14001006-4538.jpg,"来点木耳边,点缀你的美",866,140010064538,"来点木耳边,点缀你的美"
Image14001006-4570.jpg,正能量中餐厅林大厨给河南捐百万急需物资准备过程好用心,867,140010064570,正能量 餐厅林大厨 物资准备过程好用心 
Image14001006-4706.jpg,"27元开通文库会员,1.",868,140010064706,"27元开通文库会员,1."
Image14001006-4837.jpg,陈裕咸之死追踪:警方文件称假种子案10年前已撤案,869,140010064837,假种子案 警方文件 死 
Image14001006-4849.jpg,"不难发现这两位玩家已经加好友有一段时间了,两位玩家都再相互争夺榜",870,140010064849,玩家 榜 好友 
Image14001006-4862.jpg,"鸣人:5秒一印,佐助:3秒一印,他",871,140010064862,一 人 
Image14001006-4897.jpg,"听说三辰苑菜场那里拉了警戒线?""""我还能去上班吗?",872,140010064897,苑菜场 警戒线 
Image14001006-4955.jpg,"也不用刻意相夫教子,更不需走上以往名媛的社交之路.",873,140010064955,相夫 名媛 社交 
Image14001006-4977.jpg,"正月初一,很养心的几幅小画送你,充满哲理哦!",874,140010064977,小画 哲理 
Image14001006-5004.jpg,靖西市召开农村危房改造攻坚月协调会,875,140010065004,农村危房改造攻坚月协调会 靖西市 
Image14001006-5145.jpg,直播预告 | <人名>:老年高血压的诊断与治疗中国专家共识解读,876,140010065145,直播预告 治疗中国专家共识 高血压 
Image14001006-5230.jpg,"<人名>也与几位主演也在拍摄中也逐渐建立深厚友谊,在拍摄现场大玩",877,140010065230,深厚友谊 主演 
Image14001006-5337.jpg,"十四,产业布局规划",878,140010065337,"十四,产业布局规划"
Image14001006-5577.jpg,"<人名>去邓莎家不仅没带礼物,还偷懒不想干活,包贝尔",879,140010065577,包贝尔 礼物 
Image14001006-5773.jpg,"基金,股票,债券三者的不同",880,140010065773,"基金,股票,债券三者的不同"
Image14001006-5830.jpg,究竟是女神太敬业而入戏太深无法自拔?还是另有隐情呢?,881,140010065830,隐情 戏 女神 
Image14001006-5990.jpg,图为红其拉甫边检站民警在国门界碑前庄严宣誓.,882,140010065990,国门界碑 边检站民警 图 
Image14001006-6059.jpg,"呆头""电鳗万能充""爱心满满!",883,140010066059,"呆头""电鳗万能充""爱心满满!"
Image14001006-6110.jpg,新浙教版八年级上册科学作业本答案,884,140010066110,年级上册科学作业本答案 新浙教版 
Image14001006-6120.jpg,婺源县价格马犬属于大型犬吗_供应信息_金农网,885,140010066120,金农网 婺源县价格马犬 大型犬 
Image14001006-6142.jpg,"top30 · 安信三板 | 大浪淘沙沉者金,紧盯板块领头羊",886,140010066142,安信三板 沉者金 板块领头羊 
Image14001006-6179.jpg,请高手告我缺点是什么怎么改!相机如何设置啊!用的是卡片机.谢谢,887,140010066179,卡片机 相机 高手 
Image14001006-6363.jpg,"开车的过程中,我们经常因为操作步骤先后顺序的不确定,造成",888,140010066363,操作步骤 顺序 过程 
Image14001006-6385.jpg,谁来湖人囊中羞涩难抢庄神考辛斯有望再续前缘大白边也可,889,140010066385,神考辛斯 前缘大白边 湖人 
Image14001006-6434.jpg,销售人员比研发人员高20万,890,140010066434,销售人员比研发人员高20万
Image14001006-6579.jpg,心脑血管病症解剖知识挂图 医院健康文化宣传海报 人体系统解剖图,891,140010066579,心脑血管病症 知识挂图 人体系统 
Image14001006-6815.jpg,"与""火炬""空中干涉部队交战并最大程度消灭其战斗力.",892,140010066815,部队交战 大程度 火炬 
Image14001006-7103.jpg,"手臂会自然伸直,手腕应该落在方向盘上,高空作业车辆是一种由液压或",893,140010067103,作业车辆 方向盘 液压 
Image14001006-7399.jpg,3 价值评估基础.jpg,894,140010067399,3 价值评估基础.jpg
Image14001006-7603.jpg,"喜欢用偏生有书法韵味的宣纸,不适合经常用熟宣书写者",895,140010067603,书法韵味 宣纸 经常用 
Image14001006-7628.jpg,重庆夜景指南_游记,896,140010067628,重庆夜景指南_游记
Image14001006-7671.jpg,"三伏天这样吃冷饮,竟能越吃越瘦.",897,140010067671,冷饮 
Image14001006-7679.jpg,"这是线上考试的一个非常重要的方面,那么在复试前一定要交摄像头还是",898,140010067679,线上考试 摄像头 
Image14001006-7739.jpg,"其次,根据我对体相学的研究,<人名>绝对不是牙签!",899,140010067739,体相学 牙签 研究 
Image14001006-7775.jpg,劳士顿专柜正品手表男女对表情侣表商务休闲防水石英表,900,140010067775,表情侣表商务休闲防水石英表 劳士顿专柜正品手表男女 
Image14001006-7800.jpg,双色套印的聊斋志异新注一册,901,140010067800,双色套印的聊斋志异新注一册
Image14001006-7860.jpg,"<人名>纪念地""送""出精神""迎""回实地学习者",902,140010067860,纪念地 学习者 精神 
Image14001006-7891.jpg,"如果未来一段时间内我国用电需求没有增加,供大于求的情况不能缓解",903,140010067891,电需求 大于求 我国 
Image14001006-8007.jpg,"脂砚斋重评石头记(套色影印本,1975年一版一印)",904,140010068007,脂砚斋 石头 
Image14001006-8013.jpg,"说起<人名>的时候,不知道网友们会不会如小编一样会想起当年他在剧集",905,140010068013,网友们 剧集 
Image14001006-8104.jpg,奔驰v260l高顶商务专业改装厂地址报价,906,140010068104,顶商务专业改装厂地址报价 v260l 
Image14001006-8116.jpg,"此外,她还认为道格拉斯对她不忠,也不是一名称职的父亲.",907,140010068116,道格拉斯 父亲 
Image14001006-8138.jpg,博人却在和巳月仙人,908,140010068138,博人却在和巳月仙人
Image14001006-8150.jpg,"""手""绘集锦:如何保养你的手?",909,140010068150,集锦 手 
Image14001006-8164.jpg,花莲庆修院,910,140010068164,花莲庆修院
Image14001006-8187.jpg,"涨知识!详解纯净水,矿泉水,山泉水和活泉水的区别及适用人群",911,140010068187,山泉水 矿泉水 活泉水 
Image14001006-8309.jpg,"职场有约|""职上青云""讲座邀请函正在派送!注意查收",912,140010068309,讲座邀请函 青云 职场 
Image14001006-8376.jpg,我的世界手机版红石电梯怎么做 简单红石电梯攻略,913,140010068376,简单红石电梯攻略 世界手机版红石电梯 
Image14001006-8420.jpg,"三星大头三星天使!9.克烈粉丝还愿,吊打6三星重骑!10.",914,140010068420,三星大头三星天使 粉丝 星 
Image14001006-8439.jpg,为青年加油为小哥加 ,915,140010068439,为青年加油为小哥加 
Image14001006-8448.jpg,湖南省怀化市靖州苗族侗族自治县茯苓走稳,916,140010068448,湖南省怀化市靖州苗族侗族自治县茯苓 
Image14001006-8471.jpg,纳西族史诗的创造性演绎,917,140010068471,纳西族史诗的创造性演绎
Image14001006-8559.jpg,快看漫画～明日星程,918,140010068559,快看漫画～明日星程
Image14001006-8632.jpg,"按照我们中原的习俗,这么漂亮的小姐姐必须抢过来!",919,140010068632,小姐姐 习俗 中原 
Image14001006-8639.jpg,绿洲香格丽花园(别墅) 4室2厅 4500元,920,140010068639,绿洲香格丽花园 室 厅 
Image14001006-8741.jpg,看动画也能玩转艺术?成龙大哥携手蕃茄田艺术带你走进,921,140010068741,蕃茄田艺术 动画 大哥 
Image14001006-8767.jpg,"当健身遇上人工智能,fiture魔镜开启家庭科技健身新时代",922,140010068767,"人工智能,fiture魔镜 家庭科技健身新时代 "
Image14001006-8896.jpg,"金融和科技股火爆连板,a股市场的特点,赵老哥",923,140010068896,a股市场 赵老哥 科技股火爆连板 
Image14001006-8938.jpg,"工作人员走进各社区检查指导菜鸟驿站,企业,小区做好每日出入人员的",924,140010068938,菜鸟驿站 工作人员 小区 
Image14001006-9087.jpg,"邯郸有座""悬空古建筑"",仅用9根铁链保持平衡,险峻不输",925,140010069087,古建筑 铁链 邯郸 
Image14001006-9321.jpg,宿州节能除尘器价格,926,140010069321,宿州节能除尘器价格
Image14001006-9387.jpg,网友:全网穿牛仔最丑的,927,140010069387,网友:全网穿牛仔最丑的
