image_id,caption,text_id,new_image_id,new_caption
Image14001001-0000.jpg,《绿色北京》摄影大赛胡子<人名>作品,1,140010010000,绿色北京 摄影大赛胡子 作品 
Image14001001-0002.jpg,招聘计划学校现有教职工1500余人.,2,140010010002,招聘计划学校 教职工 人 
Image14001001-0191.jpg,"大厨告诉你家常做法,让你吃一回",3,140010010191,你家常做法 大厨 
Image14001001-0210.jpg,"暴雪袭击合肥:""城市守护者""带来融融暖意",4,140010010210,融融暖意 城市守护者 暴雪 
Image14001001-0214.jpg,"比乔家大院大5000倍,历时400年建成,山西民居全国罕见",5,140010010214,乔家大院 山西民居全国 
Image14001001-0220.jpg,"3月以来线上登记船舶数量实现高速增长,近三个月线上登记船舶总数为",6,140010010220,月线上登记船舶总数 线上登记船舶数量 
Image14001001-0244.jpg,"校园安全防患于未""燃"",这些要点要知道",7,140010010244,校园安全防患于 要点 
Image14001001-0261.jpg,4240万像素背照全幅 索尼rx1rii相机展出,8,140010010261,像素背照全幅 相机 
Image14001001-0341.jpg,"因为不论演谁,他都有自己独有的味道.",9,140010010341,味道 
Image14001001-0349.jpg,到底稳吗?客服说稳!会放款失败吗?,10,140010010349,客服 失败 
Image14001001-0420.jpg,"外头醒目的白底黑字招牌,洋溢著日式道地的视觉享受;店内红,黑",11,140010010420,日式道地 白底黑字招牌 店 
Image14001001-0476.jpg,"内搭的针织衫与包包同色系,还有骚气的橘色大衣,惹眼又很时髦.",12,140010010476,针织衫 橘色大衣 骚气 
Image14001001-0512.jpg,西风狂诗曲:正传创世纪战ⅲ,13,140010010512,西风狂诗曲:正传创世纪战ⅲ
Image14001001-0598.jpg,我希望你也这样做.不要为了感情抹杀自己的尊严和良心.,14,140010010598,尊严 良心 感情 
Image14001001-0638.jpg,庄严训词激发豪迈力量铮铮誓言展示忠诚品格猎猎警旗指引前进方向,15,140010010638,庄严训词 忠诚品格 豪迈力量 
Image14001001-0668.jpg,"男子骑自行车,汽车一直按喇叭,男子偏不让,结果损失了",16,140010010668,男子 喇叭 自行车 
Image14001001-0682.jpg,"48%,与去年同期相比提升6.17个百分点;线上渠道收入35.",17,140010010682,线上渠道收入 百分点 
Image14001001-0726.jpg,风机会根据需要适时开启调节湿度.,18,140010010726,风机会 湿度 
Image14001001-0763.jpg,"那么假以时日回到中国,谢晖就能够与<人名>样成为本土主帅的佼佼者",19,140010010763,本土主帅 谢晖 佼佼者 
Image14001001-0893.jpg,重庆万云招待所,20,140010010893,重庆万云招待所
Image14001001-0940.jpg,"天津6家不搞噱头却让人日日夜夜想要的素斋餐厅,也许是你净化身心的",21,140010010940,素斋餐厅 噱头 身心 
Image14001001-0950.jpg,"听说,一生有三个月的时间都在马桶上度过呢",22,140010010950,马桶 一生 时间 
Image14001001-1009.jpg,之《寸土不让》刘启端绘画【点击链接欣赏】武侠连环画《神腿杜心五》,23,140010011009,寸土不让 点击链接欣赏 神腿杜心五 武侠连环画 刘启端绘画 神腿杜心 
Image14001001-1035.jpg,"简笔画,极简也可以让你感觉有超高画技在朋友面前炫酷一下.",24,140010011035,简笔画 高画技 朋友 
Image14001001-1062.jpg,特色小吃刚哥卤肉卷,25,140010011062,特色小吃刚哥卤肉卷
Image14001001-1159.jpg,"没有吃过这些糯食,你都不知道武汉人有多会吃.",26,140010011159,糯食 武汉人 
Image14001001-1160.jpg,看图写话是低年级学生写作能力培养的重要方法.,27,140010011160,低年级学生写作能力 重要方法 图 
Image14001001-1294.jpg,"我系吧台旁边坐好,店员放将餐牌放系台面.",28,140010011294,将餐牌 店员 台面 
Image14001001-1307.jpg,"河南卫视""中国豫剧百团争霸""青年演员电视大赛晋级赛",29,140010011307,河南卫视 中国豫剧 青年演员电视大赛 
Image14001001-1411.jpg,阴阳师:说说被玩家冷落的几位版本之子 这几位式神其实真的很强,30,140010011411,几位版本 式神 玩家 
Image14001001-1472.jpg,"常觉得人因为得有个自我的形象要顾及,所以行事也就矛盾跟迂回了,说",31,140010011472,矛盾 形象 人 
Image14001001-1476.jpg,校花女神米咪开学季美图曝光 翘马尾轻盈青春尽显童真,32,140010011476,季美图 轻盈青春 校花女神 
Image14001001-1524.jpg,"截止2021,排名赛冠军数统计,亨得利和奥沙利文令人望尘莫及",33,140010011524,排名赛冠军数 奥沙利文 亨得利 
Image14001001-1545.jpg,通用ld型单梁桥式起重机 单梁吊车小起重机 电动单梁起重机,34,140010011545,电动单梁起重机 通用ld型单梁桥式起重机 单梁吊车小起重机 
Image14001001-1547.jpg,"(4)工作认真负责,热情主动,具有团队合作精神.",35,140010011547,团队合作精神 工作 
Image14001001-1616.jpg,"七勾玉轮回眼和净眼谁更强?佐助:加在一起,还没我哥的",36,140010011616,玉轮回眼 哥 
Image14001001-1665.jpg,网易首页>网易号>正文申请入驻> 把花椒擀碎或是用破壁机给打成粉,37,140010011665,网易首页 网易号 破壁机 
Image14001001-1711.jpg,欢乐积分套装助你任性拍卖!,38,140010011711,欢乐积分套装助你任性拍卖!
Image14001001-1755.jpg,"山东这列<人名>在建设中,里程494公里,途经临沂日照等",39,140010011755,临沂日照 山东这列 里程 
Image14001001-1784.jpg,网易首页>网易号>正文申请入驻> 早在波士顿凯尔特人队效力的时候,40,140010011784,网易首页 网易号 波士顿凯尔特人队效力 
Image14001001-1786.jpg,"最难捧的女演员,一年出演6部电视剧,当了38次女主角都",41,140010011786,女演员 女主角 电视剧 
Image14001001-2091.jpg,"市委书记<人名>,市长<人名>一行视察我公司人民南路施工建设",42,140010012091,市委书记 公司人民南路施工建设 一行 
Image14001001-2112.jpg,孟晚舟被加拿大暂扣5g板块下挫 华为92家供应商备全名单,43,140010012112,g板块 供应商备全名单 华为 
Image14001001-2139.jpg,陕西省结核病防治研究所 致广大学生家长的一封信,44,140010012139,陕西省结核病防治研究所 广大学生家长 信 
Image14001001-2163.jpg,卖挂还整出情怀来了丨今日最黑,45,140010012163,卖挂还整出情怀来了丨今日最黑
Image14001001-2255.jpg,"""湿邪""侵入脾胃,会引起腹泻,水肿,食欲不振,恶心等病症.",46,140010012255,病症 脾胃 水肿 
Image14001001-2283.jpg,唯美励志现代诗词5首 愿你2019闪耀光芒,47,140010012283,诗词 光芒 
Image14001001-2322.jpg,当白天遇到黑夜——读《心喜阅成长启蒙绘本.,48,140010012322,成长启蒙绘本 黑夜 心 
Image14001001-2349.jpg,"园区发展初期即成立企业服务部门,定期走访企业,听取企业意见,力求",49,140010012349,园区发展 企业意见 企业服务部门 
Image14001001-2402.jpg,国际司:培育国际合作和竞争新优势 大力推进工业通信业开放发展,50,140010012402,工业通信业 国际合作 竞争新优势 
Image14001001-2540.jpg,我爸都是铁粉的店谁说它过气了,51,140010012540,我爸都是铁粉的店谁说它过气了
Image14001001-2550.jpg,"中东此国资源匮乏,海岸线不到20公里,每年却能创造30亿美元收入",52,140010012550,国资源 中东 海岸线 
Image14001001-2706.jpg,爱普生新品投影机获中国环保节能认证,53,140010012706,中国环保节能认证 爱普生新品投影机 
Image14001001-2807.jpg,高反光 9芯军规伞绳/伞兵绳救生绳求生绳户外绳子逃生绳帐篷绳,54,140010012807,高反光 9芯军规伞绳 绳帐篷绳 
Image14001001-2899.jpg,"斗草阶前初见,穿针楼上曾逢.罗裙香露玉钗风.靓妆眉沁",55,140010012899,靓妆眉 罗裙香 草阶 
Image14001001-3037.jpg,颜值这么高的日式和菓子你吃过么?我居然在五角场找到,56,140010013037,日式 五角场 颜值 
Image14001001-3061.jpg,"小编引用了一张网上的图片,是不是很清楚了呢? 图片来源于网络",57,140010013061,图片 网络 
Image14001001-3078.jpg,发片两边蓬松中分刘海假发片无痕隐形两侧修脸流海女,58,140010013078,假发片 脸流海 痕 
Image14001001-3095.jpg,中世纪的繁盛时代再也回不来了,59,140010013095,中世纪的繁盛时代再也回不来了
Image14001001-3107.jpg,"时间过得真快,回想起上次来《拜托了冰箱》还是上次.",60,140010013107,拜托了冰箱 冰箱 时间 
Image14001001-3113.jpg,撩妹撩汉用的微信恶搞熊猫头带字表情包,61,140010013113,字表情 微信 妹 
Image14001001-3161.jpg,"这些声音,从陆仙人刚开始拍视频到现在从未间断,但他一直不屑一",62,140010013161,陆仙人 视频 声音 
Image14001001-3214.jpg,淘宝有趣商品收集录(1),63,140010013214,淘宝有趣商品收集录(1)
Image14001001-3276.jpg,"恰好发现了两名刚下水不久的非法电鱼者,此时他也看到灌阳镇的执法",64,140010013276,非法电鱼者 灌阳镇 执法 
Image14001001-3366.jpg,90后南拳套路王讲述武魂传承,65,140010013366,90后南拳套路王讲述武魂传承
Image14001001-3391.jpg,金黄稻浪鼓声响 优人池上惊艳全场,66,140010013391,惊艳全场 优人 金黄稻浪 
Image14001001-3411.jpg,纹身t恤 天龙八部众 天众,67,140010013411,纹身t恤 天龙八部众 天众
Image14001001-3508.jpg,04思维导图学古诗——遇见最美古诗词 《山行》.杜牧,68,140010013508,山行 美古诗词 思维导图 杜牧 
Image14001001-3614.jpg,"合肥新桥国际机场女安检员骚扰艺人,网友说:男人也要学会自我保护",69,140010013614,合肥新桥国际机场女安检员 艺人 男人 
Image14001001-3685.jpg,赌<人名>素颜逛街太大妈宽松卫衣遮不住大肚子长女同样变路人,70,140010013685,路人 大妈宽松卫衣 大肚子长女 
Image14001001-3720.jpg,"首先是真实场景引入,孩子会对这个问题迅速产生兴趣和熟悉感.",71,140010013720,真实场景 孩子 兴趣 
Image14001001-3744.jpg,"得益于挖孔面积的合理控制和超窄边框设计,整个手机正面的视觉效果",72,140010013744,视觉效果 孔面积 整个手机 
Image14001001-3867.jpg,"有别于矛盾丛生的争产剧,该剧运用了风趣幽默的形式来叙述郭家的喜怒",73,140010013867,争产剧 郭家 喜怒 
Image14001001-3889.jpg,图片显示白延线伸到和斑马线同步 网友论坛截图,74,140010013889,网友论坛截图 白延线 斑马线 
Image14001001-3986.jpg,"平坦的山梁之上,望不到边的大白菜正在饱饱地吸收着日照的滋养.",75,140010013986,山梁 大白菜 滋养 
Image14001001-4049.jpg,泰山爷塑像 五岳大帝 南岳大帝神像 三官大帝雕塑厂家,76,140010014049,泰山爷塑像 官大帝雕塑厂家 南岳大帝神像 
Image14001001-4110.jpg,用照片留住自己的青春~  ￥59.,77,140010014110,青春 照片 
Image14001001-4208.jpg,学党史践初心担使命软件动漫学院组织师生党员开展进寝室讲党史微党课,78,140010014208,党史微党课 使命软件动漫学院组织师生党员 初心 
Image14001001-4211.jpg,暑期童书大放价成语故事(彩图注音版4册)9064861_唯品,79,140010014211,童书 价成语故事 
Image14001001-4237.jpg,"原创在家做口水鸡,简单好做又不累,鸡肉滑嫩又多汁,鲜香麻辣超开胃",80,140010014237,口水鸡 多汁 鸡肉 
Image14001001-4260.jpg,鄂伦春舞《斗熊》.,81,140010014260,鄂伦春舞《斗熊》.
Image14001001-4280.jpg,剧版你是我的荣耀超话再美好的星空也在你面前黯淡无光 因为你是那么,82,140010014280,荣耀超话 黯淡无光 剧版 
Image14001001-4384.jpg,"2,沪镍,单k下破形成空头调整波段,短线偏空",83,140010014384,沪镍 单k 波段 
Image14001001-4470.jpg,"欢乐儿童节-长安带您""回味童年时代""",84,140010014470,时代 
Image14001001-4541.jpg,风靡全国的锅盖烤肉终于来长寿了!开业打5.8折!即将被,85,140010014541,锅盖烤肉 全国 
Image14001001-4560.jpg,一文了解新兴领域肿瘤心脏病学,86,140010014560,一文了解新兴领域肿瘤心脏病学
Image14001001-4803.jpg,"猎场呈""三低一高""新趋势:低龄化,低薪化,低成本化,高效化",87,140010014803,低薪化 低成本化 新趋势 
Image14001001-4890.jpg,"抗病毒,增强抵抗力,预防感冒及肠胃道疾病的发生. 4.",88,140010014890,肠胃道疾病 抵抗力 病毒 
Image14001001-4900.jpg,喝酒后的心情经典句子,89,140010014900,喝酒后的心情经典句子
Image14001001-4902.jpg,西甲-梅西飞铲染黄皇马2-0巴萨登顶 西班牙人1-1马竞,90,140010014902,2-0巴萨 西甲-梅西 西班牙人1-1马竞 
Image14001001-5002.jpg,中元节食俗,91,140010015002,中元节食俗
Image14001001-5146.jpg,汽车 正文  迅猛增长的业绩首先源于市场和消费者对东风雷诺产品的,92,140010015146,东风雷诺产品 正文 汽车 
Image14001001-5155.jpg,中国股市稳如磐石a股最强潜质的7大龙头谁才是真正的潜力黑马,93,140010015155,强潜质 潜力黑马 中国股市 
Image14001001-5417.jpg,"读音是""qiou""?@唐山人 说的是你吗?",94,140010015417,读音 qiou @唐山人 
Image14001001-5568.jpg,"""神的后花园""这样的美誉,喀纳斯当之无愧_汗德",95,140010015568,汗德 喀纳斯 美誉 
Image14001001-5629.jpg,安邦健康险怎么样?,96,140010015629,安邦健康险怎么样?
Image14001001-5717.jpg,08 jalen green只有职业运动员才能拥有球鞋合同?,97,140010015717,jalen green 球鞋合同 职业运动员 
Image14001001-5740.jpg,苏宁易购进入了全新的改革时代零售之王黄明瑞能否拯救,98,140010015740,王黄明瑞 改革时代零售 苏宁易购 
Image14001001-5872.jpg,"不用猜都应该想的到,这样一个责任心极重的男人,肯定又是一个彻头彻",99,140010015872,责任心 彻头彻 男人 
Image14001001-5938.jpg,冰岛火山爆发,100,140010015938,冰岛火山爆发
Image14001001-6042.jpg,"风景在路上:丹霞地貌之精华,国家地质公园——崀山自助休闲之旅",101,140010016042,丹霞地貌之精华 崀山自助休闲 国家地质公园 
Image14001001-6453.jpg,"疫情之下,在线教育迎来""大练兵""",102,140010016453,在线教育 大练兵 疫情 
Image14001001-6521.jpg,"0l,2.4l两种排量共6款车型,20万落地的预算可以买到2.",103,140010016521,0l 排量 车型 
Image14001001-6541.jpg,"<人名>追求<人名>失败恼羞成怒,不甘互撕,我有钱有什么得不到的?",104,140010016541,钱 
Image14001001-6584.jpg,"有网友希望学校取消他海洋大学的研究生入学资格,  他更是直接威胁",105,140010016584,海洋大学 研究生入学资格 学校 
Image14001001-6662.jpg,微胖搭配显高150穿搭显瘦套价格质量 哪个牌子比较好,106,140010016662,瘦套价格质量 牌子 
Image14001001-6799.jpg,"4%,而截至8月24日,8月累计成交仅1420套.",107,140010016799,套. 
Image14001001-6820.jpg,奔驰威霆装饰和配置有多豪华 改装价格_凤凰网汽车,108,140010016820,威霆装饰 凤凰网汽车 改装价格 
Image14001001-6931.jpg,除了价格空间也是它的优势小哥带你一起看哈弗h6,109,140010016931,优势小哥 价格空间 哈弗h6 
Image14001001-7019.jpg,学党史悟思想办实事开新局南江县仁和镇五个一推动党史学习教育走深走,110,140010017019,新局南江县仁和镇 党史 实事 
Image14001001-7050.jpg,华熙live528即将揭幕 成都新添文体生活打卡胜地,111,140010017050,文体生活打卡胜地 华熙live528 成都 
Image14001001-7113.jpg,钱枫被曝性侵酒色与金钱的权力游戏,112,140010017113,钱枫 权力游戏 酒色 
Image14001001-7137.jpg,为肝脏排毒,113,140010017137,为肝脏排毒
Image14001001-7387.jpg,庄里的亲们赶紧去看看!,114,140010017387,庄里的亲们赶紧去看看!
Image14001001-7403.jpg,本文由极果没ъ教逶,115,140010017403,本文由极果没ъ教逶
Image14001001-7462.jpg,指挥刀柄,116,140010017462,指挥刀柄
Image14001001-7489.jpg,"不想剪掉及腰长发,那就扎个时髦马尾清爽一夏!",117,140010017489,时髦马尾 腰长发 
Image14001001-7575.jpg,"福州橘园洲东桥头""动手术""缓堵 4条匝道将封闭改造",118,140010017575,福州橘园洲 匝道 手术 
Image14001001-7673.jpg,"华尔街生死大战,游戏驿站暴跌,放几个英国房东的出租案例来压压惊",119,140010017673,游戏驿站 出租案例 英国房东 
Image14001001-7850.jpg,【荒岛音乐趴】| 特价399 | 快艇 浮潜 烧烤露营 音乐,120,140010017850,荒岛音乐趴 荒岛音乐 浮潜 烧烤 特价 
Image14001001-7908.jpg,痛心又一起袭警事件发生民警生命安全究竟该如何保障,121,140010017908,警事件 民警生命安全 
Image14001001-7936.jpg,"雁塔区未来五年商贸规划:打造""一核四区多中心""发展格局!",122,140010017936,商贸规划 发展格局 雁塔区 
Image14001001-7938.jpg,"在大众的印象中,豪华车基本上都是以黑色为主,显示出黑色和稳重的",123,140010017938,豪华车 黑色 大众 
Image14001001-7943.jpg,大北京的外卖金字塔让,124,140010017943,大北京的外卖金字塔让
Image14001001-7946.jpg,【春申连心】民建闵行区委赴福建南平开展学习交流活动,125,140010017946,春申连心 福建南平 交流活动 民建闵行区委 
Image14001001-7949.jpg,"中国女排,六连胜!",126,140010017949,"中国女排,六连胜!"
Image14001001-8029.jpg,这里是北京之雍和宫里展出的精品佛像_手机搜狐网,127,140010018029,雍和宫 手机搜狐网 精品佛像 
Image14001001-8053.jpg,泾县开展2020年防汛抢险综合实战演练,128,140010018053,防汛抢险综合实战演练 
Image14001001-8201.jpg,"""面对马上就要到来的大学生活<人名>充满着向往她表示接下来将继续",129,140010018201,大学生活 
Image14001001-8419.jpg,"在某种意义上说,宇宙是由微",130,140010018419,"在某种意义上说,宇宙是由微"
Image14001001-8437.jpg,"母亲是<人名>长女李敏,父亲是孔从洲将军之子<人名>.",131,140010018437,长女李敏 孔从洲将军 父亲 
Image14001001-8486.jpg,"钢骨本名为维克多·斯通,在一次爆炸意外中受到濒死的重伤,他的父亲",132,140010018486,钢骨 濒死 重伤 
Image14001001-8499.jpg,"厦门大学深圳研究院首席代表,德高望众的黄良快老先生一行莅临集团",133,140010018499,厦门大学深圳研究院首席代表 黄良 老先生一行 
Image14001001-8507.jpg,"1,不按交易计划行事,临时起意,盘中忽然决定开新仓.",134,140010018507,新仓 交易计划 意 
Image14001001-8529.jpg,明悦,135,140010018529,明悦
Image14001001-8621.jpg,"oppo watch 2值不值得买?看看知乎,京东等平台的评价",136,140010018621,知乎 京东 oppo 
Image14001001-8830.jpg,"同时我公司的玻璃制品畅销国内外,与众多企业达成了长期合作关系并",137,140010018830,玻璃制品畅销 长期合作关系 企业 
Image14001001-8861.jpg,眉毛看相有痣命运好不好?,138,140010018861,眉毛看相有痣命运好不好?
Image14001001-8882.jpg,"尺度与耻度齐飞「深夜剧」,岛国真敢拍|相亲|小梅",139,140010018882,尺度与耻度 岛国 
Image14001001-8951.jpg,解庆伦校长对疫情防控工作作重点强调和部署参会教师认真听会会议最后,140,140010018951,教师认真听会会议 疫情防控工作 校长 
Image14001001-8983.jpg,"而且生肖马之人天生福气深厚,不仅年纪轻轻就能有所建树.",141,140010018983,生肖马 福气 建树 
Image14001001-9081.jpg,<人名>实在太可爱啦!表演赛!,142,140010019081,表演赛 
Image14001001-9127.jpg,"这玩意和玉米共生,农民看到都头疼,在国外却是美食,7美元1斤",143,140010019127,玉米共生 玩意 美食 
Image14001001-9223.jpg,华一实验学校,144,140010019223,华一实验学校
Image14001001-9233.jpg,花呗怎么提前还款查看利息,145,140010019233,花呗怎么提前还款查看利息
Image14001001-9251.jpg,"话不多说,看看具体情况吧!关注31分钟前 体育领域创作者孟哥说球",146,140010019251,体育领域创作者孟哥 具体情况 球 
Image14001001-9284.jpg,"「多少moreless」北京第一代""闪店""",147,140010019284,闪店 北京 
Image14001001-9291.jpg,"机构需求太旺盛!这类基金百亿爆款频出,今年最最少也有6只!",148,140010019291,机构需求 爆款 基金 
Image14001001-9377.jpg,南昌市治幼儿眼部血管瘤,149,140010019377,南昌市治幼儿眼部血管瘤
Image14001001-9458.jpg,联通手机大卖场,150,140010019458,联通手机大卖场
Image14001001-9461.jpg,绿驹电车,151,140010019461,绿驹电车
Image14001001-9486.jpg,天喜筋力源f筋力源d面条增筋剂面条拉面烩面刀削面速效强筋剂1kg,152,140010019486,喜筋力 f筋力源d面条增筋剂面条拉面 刀削面速效强筋剂 
Image14001001-9490.jpg,"有些地区,洗一次衣服要重染一次,以保证色彩鲜艳.",153,140010019490,色彩 衣服 地区 
Image14001001-9548.jpg,微信早上好祝福语图片,154,140010019548,微信早上好祝福语图片
Image14001001-9578.jpg,"比如人们会用""相濡以沫"",来赞美爱人的相互扶持.",155,140010019578,爱人 人们 
Image14001001-9627.jpg,安全考核细则,156,140010019627,安全考核细则
Image14001001-9744.jpg,"另外,它还支持后盖定制服务,也代表了手机模块化的趋势.",157,140010019744,手机模块化 定制服务 趋势 
Image14001001-9816.jpg,"这五种寓意友情地久天长的花,送给一直默默陪伴,守护的朋友们!",158,140010019816,朋友们 友情 天长 
Image14001001-9867.jpg,中国县域经济100强研究成果 江苏领先苏州前五占三席,159,140010019867,中国县域经济 强研究成果 苏州 
Image14001002-0009.jpg,共筑强军梦 翰墨抒情怀,160,140010020009,共筑强军梦 翰墨抒情怀
Image14001002-0011.jpg,"琦玉已经变成表情包了.琦玉啥也不管了,要出全力了.",161,140010020011,琦玉 .琦玉 表情 
Image14001002-0055.jpg,"这样一个寄托了你所有的期望的儿子,有时候真是让妈妈们无比骄傲.",162,140010020055,妈妈们 儿子 期望 
Image14001002-0067.jpg,要行管政议复与征地补偿安置尽议裁争袭制度昔有许多共同之,163,140010020067,征地补偿安置尽议 政议 制度 
Image14001002-0135.jpg,"<人名>《爱我》蜕变 ""反恐精英""变身时尚设计师",164,140010020135,爱我 时尚设计师 恐精英 蜕变 
Image14001002-0182.jpg,"荆门天地2期是哪个开发商开发的,荆门天地小区开发商资质如何",165,140010020182,荆门天地小区开发商资质 荆门天地2期 
Image14001002-0310.jpg,"左搂<人名>,右抱<人名>,30年前的「<人名>」好风流",166,140010020310,
Image14001002-0350.jpg,"但是不可忽视的是,年轻人的生活压力反而更大了",167,140010020350,生活压力 年轻人 
Image14001002-0364.jpg,q4:入学后该怎么找到自己宿舍?,168,140010020364,q4 宿舍 
Image14001002-0381.jpg,【小资chic】上海时装周独家专访:朱赞锦,169,140010020381,小资chic 朱赞锦 上海时装周 
Image14001002-0382.jpg,运势一路飘红事业大翻身财运旺富贵来的三生肖,170,140010020382,财运 红事业大 运势 
Image14001002-0388.jpg,她漫无目的地走在冰冷的大街上.,171,140010020388,目 大街 
Image14001002-0431.jpg,"三,十二星座本周表白成功指数!",172,140010020431,成功指数 星座 
Image14001002-0518.jpg,"只会做红烧鱼,不妨试这外酥里嫩的酥炸鱼柳,搭配啤酒看球真过瘾",173,140010020518,红烧鱼 鱼柳 啤酒 
Image14001002-0532.jpg,女式夏银吊坠饰品配饰,174,140010020532,女式夏银吊坠饰品配饰
Image14001002-0548.jpg,【名庄直采】法国拉菲传奇干红葡萄酒6支装2016-【买,175,140010020548,名庄直采 法国拉菲传奇干红葡萄酒 名庄 
Image14001002-0572.jpg,"早晨火箭和奇才完成了一笔交易,火箭将拉塞尔-拉斯布鲁克交易至奇才",176,140010020572,拉塞尔-拉斯布鲁克交易 奇才 火箭 
Image14001002-0576.jpg,"在其后接受《东方早报·艺术评论》独家专访时,他谈起了宋画与他的",177,140010020576,东方早报·艺术评论 宋画 早报 艺术 
Image14001002-0697.jpg,"《终极斗罗》史莱克七怪成神之路,蓝轩宇:我已垫好,这",178,140010020697,终极斗罗 史莱克 蓝轩宇 神 
Image14001002-0714.jpg,"把养乐多加入到芒果汁里,没想到味道这么好喝,夏天做",179,140010020714,养乐 芒果汁 味道 
Image14001002-0715.jpg,"嘘!舟山群岛马拉松原来有个这样的""秘密""!很多人不知道",180,140010020715,舟山群岛马拉松 秘密 人 
Image14001002-0811.jpg,解读英国西班牙百年直布罗陀归属之争,181,140010020811,英国西班牙 直布罗陀 争 
Image14001002-0841.jpg,"设计师利用鲜艳可爱的多年生植物来柔化住宅的轮廓线条,同时为场地",182,140010020841,柔化住宅 多年生植物 轮廓线条 
Image14001002-0965.jpg,"""""进来.""话音刚落,一个小女孩闪进了我的办公室.",183,140010020965,小女孩 话音 办公室 
Image14001002-0982.jpg,新本威胜100-42 办完牌照 汽车下乡补贴,184,140010020982,汽车下乡补贴 牌照 威 
Image14001002-1059.jpg,"黄瓜鸡蛋面是一种以黄瓜,面条为原料的食物,口味清淡.",185,140010021059,黄瓜鸡蛋面 面条 口味 
Image14001002-1088.jpg,"
97再抽一件全队签名队服长城限定版!",186,140010021088,"
 全队签名队 长城 "
Image14001002-1142.jpg,"除節約用水的設計外,陳家滔亦關心弱勢社群,在學時就為視障人士專門",187,140010021142,學時 設計 節約 
Image14001002-1239.jpg,"""生完孩子后,我看到老公就火大,天天看他哪里都不顺眼",188,140010021239,老公 孩子 火 
