image_id,caption,text_id,new_image_id,new_caption
Image14001003-2317.jpg,lichee荔枝法餐厅法国水师兵营,374,140010032317,lichee荔枝法餐厅法国水师兵营 
Image14001003-2342.jpg,"无休眠期,耐寒,在北方被广泛种植.",375,140010032342,
Image14001003-2448.jpg,乙一华丽旅行怪谈,376,140010032448,乙一华丽旅行怪谈
Image14001003-2512.jpg,老街名人留踪系列(五):光华街上一贴膏药卖了三百多年,377,140010032512,光华街 人留踪系列 膏药 
Image14001003-2684.jpg,"移动互联时代,平安人寿顺势而为将理赔流程线上化,利用拍照上传资料",378,140010032684,平安人寿 理赔流程线上化 移动互联时代 
Image14001003-2850.jpg,三维工匠宝宝满月万元绸缎布艺红包袋个性创意周岁利,379,140010032850,绸缎布艺红包袋个性创意 工匠宝宝满月 利 
Image14001003-2973.jpg,岭南书画名家<人名>绘画品鉴会在深圳成功举办,380,140010032973,岭南书画名家 绘画 深圳 
Image14001003-2979.jpg,星途凌云400t搭载m3x火星架构pro下的最新2.,381,140010032979,星途凌云 m3x火星架构pro下 t 
Image14001003-3084.jpg,"推广植保无人机播种技术,提升水稻生产机械化水平",382,140010033084,植保无人机播种技术 水稻生产机械化水平 
Image14001003-3101.jpg,"区安监局查证属实后,便对该地违规存放危险化学品的责任人作出行政",383,140010033101,危险化学品 区安监局 责任人 
Image14001003-3163.jpg,"怀孕30周,最近两天白带特别多,像黄鼻涕,有图片",384,140010033163,鼻涕 白带 图片 
Image14001003-3234.jpg,辽宁方大集团实业有限公司,385,140010033234,辽宁方大集团实业有限公司
Image14001003-3377.jpg,"加速由区域防卫型向全域作战型转变,向着建设一支强大的现代化新型",386,140010033377,全域作战型 区域防卫型 现代化 
Image14001003-3530.jpg,玉雕刻拍摄10|静物|摄影|羽光摄影 - 原创设计作品,387,140010033530,羽光摄影 玉雕刻 原创设计作品 
Image14001003-3804.jpg,"2016全能型投资产品即将引爆南昌,作为南昌人必须要知道!",388,140010033804,南昌人 全能型投资产品 
Image14001003-3848.jpg,威斯康星大学的天文学家们采用超过200万张斯皮策空间望远镜的图像,389,140010033848,威斯康星大学 天文学家们 张斯皮策空间望远镜 
Image14001003-3873.jpg,直击新乡特大暴雨#(顶端新闻记者 万马)大河报的微博视频,390,140010033873,特大暴雨 微博视频 大河报 
Image14001003-3914.jpg,"对于违规接收""五升六""学生或造成不良影响或严重后果的学校,视情节",391,140010033914,严重后果 不良影响 学生 
Image14001003-3933.jpg,中国古典讲唱文学丛书 再生缘 (上中下) 一版一印,392,140010033933,文学丛书 再生缘 版 
Image14001003-4023.jpg,"我国初期的最先进护卫舰,拖入上海某船厂将有望迎来一次大换血!",393,140010034023,先进护卫舰 船厂 上海 
Image14001003-4061.jpg,恋与制作人图片赏析 高清无水印壁纸全收录,394,140010034061,水印壁纸 制作人图片赏析 
Image14001003-4137.jpg,"若按照睡眠阶段来划分,夜班模式具体应该是这样的.",395,140010034137,夜班模式 睡眠阶段 
Image14001003-4210.jpg,财神爷爷资金被盗 数万元深夜被提走,396,140010034210,财神爷爷资金 
Image14001003-4338.jpg,据说是汉源神女在离开汉江源头时专门祈求龙王留下这条龙来为汉江源头,397,140010034338,汉江源头 神女 龙王 
Image14001003-4420.jpg,"等,坐享公园纯氧,让您健康无忧.",398,140010034420,公园纯氧 忧 
Image14001003-4441.jpg,"如果您曾经留意平行进口车市场,那么您一定对一款跨界车有一定印象—",399,140010034441,界车 一定印象 平行进口车市场 
Image14001003-4448.jpg,i日款老公生同卡片祝n快手福男友 女妈g妈给的o送礼物,400,140010034448,i日 卡片祝n快手福男友 女妈g妈 
Image14001003-4513.jpg,"没有大毛病,秘诀就是整年喝着自家的蜂蜜,吃着各种蜂产品,接待客人",401,140010034513,蜂产品 大毛病 蜂蜜 
Image14001003-4554.jpg,基层动态|从江农商银行举行首笔扶贫产业子基金投放仪式,402,140010034554,基层动态 扶贫产业子基金投放仪式 从江农商银行 
Image14001003-4632.jpg,"低级别,价格低廉,适用于要求不高的环境及条件中. 3.",403,140010034632,低级别 适用于要求 环境 
Image14001003-4704.jpg,"四是陶坛透气性好但不渗漏,酒体与外界微生物群息息相通,自然吐纳",404,140010034704,陶坛透气性 外界微生物群息息相通 酒体 
Image14001003-4903.jpg,"这癌症,许多名人都没躲过!有一项检查男性体检最好都做做.",405,140010034903,检查男性体检 癌症 人 
Image14001003-5129.jpg,孟鹤堂鄂靖文是不是在一起?,406,140010035129,孟鹤堂鄂靖文是不是在一起?
Image14001003-5215.jpg,爆冷夺金惊天大逆转火箭状元榜眼全都要,407,140010035215,夺金惊天大逆转火箭状元榜眼 
Image14001003-5263.jpg,top4:<人名>&top8:灵公主,408,140010035263,灵公主 &top8 top4 
Image14001003-5269.jpg,"这导致,这个承诺很有可能会被他排在最好.",409,140010035269,
Image14001003-5296.jpg,推荐口齿留香的12道下饭菜荤素搭配营养美味让你回味无穷,410,140010035296,饭菜荤素 营养美味 口齿 
Image14001003-5354.jpg,"又到狗中表情之王柴犬出场了,这一个表情可真的不容易呢!",411,140010035354,王柴犬 表情 狗 
Image14001003-5356.jpg,"命带多婚,今年感情多变的生肖|丁火|忌神|婚姻宫|地支",412,140010035356,婚姻宫 生肖 多婚 
Image14001003-5396.jpg,"而这,正是<人名>的人生重要转折点.",413,140010035396,人生重要转折点 
Image14001003-5425.jpg,6元/平.这是继11月惠阳连续流拍3宗商住地后成交的第一宗地.,414,140010035425,商住地 惠阳连续流拍 
Image14001003-5455.jpg,"求动漫污污女壁纸~手机高清竖屏壁纸,越多越好",415,140010035455,手机高清竖屏壁纸 动漫污污女壁纸 
Image14001003-5589.jpg,"村里的墙绘,你怎么这么好看!",416,140010035589,"村里的墙绘,你怎么这么好看!"
Image14001003-5598.jpg,"中国书协会员,中国书法研究院副院长,教授)",417,140010035598,中国书法研究院副院长 中国书协会员 教授 
Image14001003-5698.jpg,馨诺肥料化肥10g颗粒控释缓释肥花卉盆栽果蔬多肉富土培通用,418,140010035698,馨诺肥料化肥 g颗粒控释 肥花卉盆栽果蔬多肉富土 
Image14001003-5808.jpg,一流重点高中和普通高中最大的区别是什么呢,419,140010035808,普通高中 一流重点高中 区别 
Image14001003-6005.jpg,"英国男子从万米高空跳下,时速400km与布加迪威龙超跑相当",420,140010036005,英国男子 布加迪威龙超跑相当 km 
Image14001003-6006.jpg,"枫香印染手工技艺历经百余年从未中断,皆源于流行地区民风民俗的需要",421,140010036006,枫香印染手工技艺 地区民风民俗 
Image14001003-6125.jpg,"目前青岛至云南还没有直达列车,济南至昆明高铁年底开通后,青岛市民",422,140010036125,青岛市民 昆明高铁 列车 
Image14001003-6190.jpg,"<人名>那么高的手术成功率,<人名>自创的肝脏解剖理论,<人名>自创的",423,140010036190,手术成功率 肝脏解剖理论 自创 
Image14001003-6247.jpg,阿国海鲜自助餐厅,424,140010036247,阿国海鲜自助餐厅
Image14001003-6387.jpg,惊险剧毒眼镜王蛇晚上溜进居民小区ta们已多次造访,425,140010036387,居民小区ta们 惊险剧毒眼镜王蛇 
Image14001003-6388.jpg,南京师范大学文艺学2022考研经验及备考指导,426,140010036388,备考指导 南京师范大学文艺学 经验 
Image14001003-6470.jpg,让车生活更快乐解锁第七代伊兰特那些神奇技能,427,140010036470,神奇技能 车生活 伊兰特 
Image14001003-6504.jpg,"前期判断很重要,这3点教你快速判断",428,140010036504,
Image14001003-6531.jpg,"""当时他正在拍摄《风起霓裳》,已经到了尾声阶段,每天收工时间都在",429,140010036531,风起霓裳 尾声阶段 霓裳 风 时间 
Image14001003-6599.jpg,中评分析:赖清德上台拼经济太沉重?,430,140010036599,中评分析 经济太 赖清德 
Image14001003-6707.jpg,"一个把爱情,婚姻,孩子分别给了三个男人的女人,最终活",431,140010036707,婚姻 爱情 男人 
Image14001003-6799.jpg,"再加上鲨鱼鳍双风扇2.0版本散热系统,拥有更高转速和更大风量.",432,140010036799,鲨鱼鳍 高转速 大风量 
Image14001003-6804.jpg,"电子挡杆的设计很有新意,摸起来的质感也不错,袖珍的造型出现在偌大",433,140010036804,造型出现在 电子挡杆 质感 
Image14001003-6901.jpg,退潮后方知谁在裸泳 共享汽车或迎来洗牌,434,140010036901,裸泳 牌 汽车 
Image14001003-6946.jpg,男子见义勇为受伤成植物人 赔偿难执行或将断药,435,140010036946,植物人 药 男子 
Image14001003-7062.jpg,"4亿)来计算,只有0.08爽违规经营贷流入楼市.比如,深圳.",436,140010037062,爽违规 贷 楼市 
Image14001003-7091.jpg,中国供应商出厂价格8.8级高强度碳钢内六角螺栓内六角螺钉,437,140010037091,中国供应商 级高强度碳钢 螺钉 
Image14001003-7168.jpg,"【疫情防控建议】程实 <人名> | 经济战""疫"":市场渐进",438,140010037168,疫情防控建议 经济战 疫 市场 
Image14001003-7243.jpg,"""二暖""即康乃馨住院探视和赔后慢病管理.",439,140010037243,慢病管理 
Image14001003-7271.jpg,"《惊奇队长》卡罗尔大战雷神托尔,谁才是复仇者最强英雄?",440,140010037271,惊奇队长 卡罗尔大战 强英雄 托尔 
Image14001003-7421.jpg,越南总理范明政会见熊波大使_发展,441,140010037421,熊波大使 越南总理范明政 发展 
Image14001003-7470.jpg,怕孤厌闹 长街旧人. 别等时光非礼了梦想.,442,140010037470,长街旧人 孤厌 时光 
Image14001003-7534.jpg,现货 火影番赏4款 土影长门药师兜手鞠pvc手办公仔摆件模型,443,140010037534,土影长门药师兜手 公仔摆件模型 现货 
Image14001003-7636.jpg,"尽管在和男主打赌之后会因为拖延症不想工作,但是看到男主随随便便就",444,140010037636,症不想工作 男主 
Image14001003-7730.jpg,感谢鼓励与支持!,445,140010037730,感谢鼓励与支持!
Image14001003-7776.jpg,六方合斗壶,446,140010037776,六方合斗壶
Image14001003-7906.jpg,"显然没有时间交女友,所以关于他与王佩雯交往多年的传闻的确不属实",447,140010037906,王佩雯交往 女友 传闻 
Image14001003-7976.jpg,"绍兴老街,弄堂窄窄的,白墙黑瓦,环城河静静的流淌,乌篷船慢慢摇摆",448,140010037976,弄堂窄窄 绍兴老街 白墙黑瓦 
Image14001003-8025.jpg,陕西悍匪贼王<人名>被执行死刑前提出以绝技换命结局怎样,449,140010038025,命结局 陕西悍匪贼王 绝技 
Image14001003-8142.jpg,"产品具有一定个性的小杨生煎,凤起小笼等则可以归为包点品类的时尚",450,140010038142,小杨生煎 包点品类 一定个性 
Image14001003-8278.jpg,"在刺骨河水中泡了21分钟,这名辅警与队友终于将落水者救上岸",451,140010038278,刺骨河水 队友 辅警 
Image14001003-8393.jpg,德转预测皇马首发姆巴佩阿拉巴在列首发球员总身价达58亿欧,452,140010038393,球员总身价 姆巴佩 皇马 
Image14001003-8428.jpg,股神谋求转型:巴菲特欲以300亿美元洽购精密机件,453,140010038428,精密机件 股神 巴菲特 
Image14001003-8431.jpg,"安琪的日志93.儿时的年味|新衣,美食&鞭炮",454,140010038431,安琪 新衣 日志 
Image14001003-8475.jpg,"中华文明教化蛮夷,使他们",455,140010038475,"中华文明教化蛮夷,使他们"
Image14001003-8528.jpg,"实现台模合振,以加大振动速度的效果.",456,140010038528,振动速度 台模合振 效果 
Image14001003-8580.jpg,"17所军校2018年在广东招生专业和名额公布,过5关方能",457,140010038580,广东招生专业 军校 5关 
Image14001003-8705.jpg,某中餐厅带厨房装修cad平面施工图纸,458,140010038705,厨房装修cad平面施工图纸 餐厅 
Image14001003-8814.jpg,北京市生态葬最多可获4000元补贴,459,140010038814,北京市生态 补贴 
Image14001003-8819.jpg,"阳在舞台上一扭,瞬间就把人勾到复古氛围中跟着一起嗨了看着在现场被",460,140010038819,复古氛围 阳 舞台 
Image14001003-8880.jpg,"""归乡""还将提供一条全新的故事主线,新角色亦会同步登场.",461,140010038880,故事主线 新角色 乡 
Image14001003-9004.jpg,水泥检查井规格-广州市黄埔区水泥检查井-荣智建材,462,140010039004,荣智建材 井规格 广州市黄埔区水泥 
Image14001003-9088.jpg,汽车离合器总成装配线试验台 - 科博达 - 九正建材网,463,140010039088,建材网 汽车离合器总成装配线试验台 科博达 
Image14001003-9108.jpg,"戴手表不仅彰显地位身份,更是成熟自信象征!",464,140010039108,地位身份 手表 象征 
Image14001003-9141.jpg,器火星探测器载人飞船火箭科技创新发明自主研发设备成果展示国家力,465,140010039141,设备成果 国家力 器火星探测器载人飞船火箭科技创新发明 
Image14001003-9142.jpg,"雄鹿夺冠,金靴奖该给谁?字母哥名场面多,但洛佩兹才是",466,140010039142,字母哥 夺冠 奖 
Image14001003-9319.jpg,黄山特色民宿酒店该如何装修设计,467,140010039319,黄山特色民宿酒店 设计 
Image14001003-9521.jpg,虽然<人名>和丁伟之间究竟孰强孰弱很多人一时之间谁也说服不了谁,468,140010039521,多人 丁伟 
Image14001003-9574.jpg,引经药小议,469,140010039574,引经药小议
Image14001003-9589.jpg,"二木带你逛展|日本东京国际园艺展的作品,好看到流泪!",470,140010039589,日本东京国际园艺展 展 木 
Image14001003-9721.jpg,"李嫣花百万上贵族学校交白卷,晒图自嘲与数学无缘,却",471,140010039721,贵族学校 李嫣 白卷 
Image14001003-9797.jpg,主题:世界级的服装批发市场 常熟招商城旺铺出售 快来抢啊,472,140010039797,常熟招 服装批发市场 旺铺 
Image14001003-9886.jpg,"8,樟脑球驱蚂蚁宠派养花大全将准备好的樟脑球磨成粉末撒在蚂蚁经常",473,140010039886,樟脑球 蚂蚁宠派 花大全 
Image14001003-9932.jpg,理查德·普林斯携新展重回高古轩,474,140010039932,新展 高古轩 理查德·普林斯 
Image14001003-9962.jpg,现货【外图台版】日据时期的香港简史 / 小椋广胜 香港商务印书馆,475,140010039962,外图台版 小椋广胜 日据时期 香港简史 
Image14001004-0021.jpg,"荆门一轿车突然失控侧翻撞树上,司机被困车内出",476,140010040021,荆门 司机 轿车 
Image14001004-0106.jpg,"经国内权威检测中心和大型下游用户企业鉴定,各项性能指标均可与日本",477,140010040106,性能指标 权威检测中心 用户企业鉴定 
Image14001004-0205.jpg,"铁铉死后,他的家人也没能躲过一劫.",478,140010040205,劫 家人 
Image14001004-0244.jpg,"三门版北京212实车曝光,搭载1.5t国六发动机",479,140010040244,三门版北京 实车 发动机 
Image14001004-0285.jpg,"吐槽下罗布奥特曼剧场版:期待很大,但也有些许雷人",480,140010040285,罗布奥特曼剧场版 雷人 
Image14001004-0341.jpg,迪迦奥特曼飞船娘化:胜利飞燕号jk造型抢镜,481,140010040341,奥特曼飞船娘化 jk造型 
Image14001004-0361.jpg,但这次高空历险还是给他留下了航空性中耳炎和噪音性听力受损的后遗症,482,140010040361,航空性中耳炎 噪音性听力 后遗症 
Image14001004-0377.jpg,"""而后又对阎鹤祥说:""职业你曾经拥有过!",483,140010040377,阎鹤祥 职业 
Image14001004-0526.jpg,"老子打仗时多少难打的据点都拿下了,还怕你这个梳着两条长辫子的资产",484,140010040526,长辫子 据点 老子 
Image14001004-0534.jpg,"大清摄政王多尔衮早早就死了,这给我们现代人,带来什么启发呢?",485,140010040534,政王多尔衮 现代人 启发 
Image14001004-0628.jpg,"大家对于低保家庭情况调查和""懒汉""不能吃低保又是怎样看待的呢?",486,140010040628,低保家庭情况调查 懒汉 
Image14001004-0650.jpg,跨界融合 品高艺精 ——访著名艺术家刘光,487,140010040650,著名艺术家刘光 高艺 界 
Image14001004-0742.jpg,英国| 快乐小猴果蔬汁饮料180ml(3款),488,140010040742,快乐小猴果蔬汁饮料 英国 
Image14001004-0812.jpg,"泳坛王者! 孙杨8年狂拿6个世界第一, 自曝曾拖着伤腿奥运摘银",489,140010040812,泳坛王者 腿奥运 孙杨8年 
Image14001004-1041.jpg,"二维代码:读取静止,中椿蛴∷⒃诒昵┥系移动中的二维码.",490,140010041041,⒃诒昵 中椿蛴 二维码 
Image14001004-1190.jpg,这次是思维导图双证班!,491,140010041190,这次是思维导图双证班!
Image14001004-1192.jpg,兰州南特数码科技股份有限公司还与管理学院共同建立了学生实习基地,492,140010041192,管理学院 兰州南特数码科技股份有限公司 学生实习基地 
Image14001004-1257.jpg,"春节开工请注意,又一女子手被面条机""吞食""",493,140010041257,面条机 女子手 开工 
Image14001004-1290.jpg,"白胡椒和咖啡粒的味道.此酒强烈,多汁,柔滑,带有细微的橡木味.",494,140010041290,橡木味 多汁 白胡椒 
Image14001004-1293.jpg,稻盛和夫你的好心总被当成驴肝肺2个步骤好心才管用,495,140010041293,驴肝肺 步骤好心 稻盛和夫 
Image14001004-1390.jpg,"新车标配了前后卤素大灯和大灯高度可调功能,中高配车型还增加了大灯",496,140010041390,卤素大灯 高配车型 新车标配 
Image14001004-1457.jpg,记五六七年级小学初中生统编格列佛游记必读原版原著老人与海世界名著,497,140010041457,年级小学初中生统编格列佛游记 原版原著老人与海世界名著 
Image14001004-1484.jpg,作文大赛初赛作品父亲的目光,498,140010041484,作文大赛初赛作品父亲的目光
Image14001004-1496.jpg,远特信时空将传统通信领域的专业经验与移动转售市场的运营服务相结合,499,140010041496,运营服务 专业经验 传统通信领域 
Image14001004-1513.jpg,艺术家分享《血源2》设定图 画面明亮与原作相距甚远,500,140010041513,血源2 原作 艺术家 血源 画面 
Image14001004-1574.jpg,"热忱欢迎有理想,有梦想的初三学子来校就读!",501,140010041574,初三学子 梦想 理想 
Image14001004-1642.jpg,"女人有没有大<人名>, 旺夫旺财的还蠛妹, 手相就能看出来",502,140010041642,旺夫 女人 手 
Image14001004-1683.jpg,恐龙插肩儿童棒针圆领套头毛衣有编织图解,503,140010041683,头毛衣 肩儿童棒针 恐龙 
Image14001004-1695.jpg,音乐/广播系统,504,140010041695,音乐/广播系统
Image14001004-1763.jpg,盘点:基本面最强硬的公司!中远海控合理股价空间50%,505,140010041763,中远海控合理股价空间 盘点 基本面 
Image14001004-1883.jpg,"推广直播预告,用户可以订阅开播提醒",506,140010041883,推广直播预告 用户 
Image14001004-1894.jpg,温度表温泉j泡供防水测温石显显示器温度计仿数池厂家仪电子直,507,140010041894,温度表温泉j 数池厂家仪电子 显示器温度 
Image14001004-1980.jpg,游游仙朝越蓝莓庄园给我一颗蓝莓的时间开启夏日幸福,508,140010041980,蓝莓庄园 游仙 时间 
Image14001004-1988.jpg,小编逛店:科勒卫浴 高端品质带来五星享受,509,140010041988,科勒卫浴 高端品质 店 
Image14001004-1993.jpg,国内首台集装箱核酸检测实验室来了!这家企业复工后大,510,140010041993,集装箱核酸检测实验室 企业 
Image14001004-2044.jpg,"""足不出院""的远程提审",511,140010042044,"""足不出院""的远程提审"
Image14001004-2108.jpg,"蝴蝶兰:收翅如瓜,展翅像蝶,健康盛开,蝴蝶自来",512,140010042108,收翅如瓜 蝶 蝴蝶 
Image14001004-2148.jpg,换鞋凳储物凳欧式创意时尚服装店沙发凳脚踏水晶凳床尾凳皮凳长凳,513,140010042148,鞋凳 水晶凳床尾凳皮凳长凳 物凳欧式创意时尚服装店沙发凳 
Image14001004-2330.jpg,"心里有爱,就要鼓足勇气向喜欢的人表白,别给自己留下遗憾.",514,140010042330,勇气 人 
Image14001004-2386.jpg,父女恋急不得?<人名><人名>被催婚,515,140010042386,父女 婚 
Image14001004-2405.jpg,缪斯美妆护肤,516,140010042405,缪斯美妆护肤
Image14001004-2430.jpg,"为的就是营造一种真正有内在美,外表却低调不张扬的穿衣调性.",517,140010042430,穿衣调性 外表 美 
Image14001004-2541.jpg,"为此,凌小娟直言不讳地要求享受同等待遇,遭到凌小云的断然拒绝.",518,140010042541,同等待遇 小云 小娟 
Image14001004-2582.jpg,在体育场外面等待的时光.【&lt;(~)~)&gt;】,519,140010042582,&lt;(~)~)&gt; 体育场 lt gt 时光 
Image14001004-2680.jpg,康宝莱参加直企创新经营监管风险性研究活动_发展,520,140010042680,创新经营监管风险性研究活动 康宝莱 发展 
Image14001004-2685.jpg,"既失去了灵气又没了<人名>本该有的朝气与活力,再摊上这营养",521,140010042685,朝气 灵气 营养 
Image14001004-2736.jpg,"但不论如何,人类在宇宙面前都非常渺小.",522,140010042736,宇宙 人类 
Image14001004-2794.jpg,"建议:年初因为春节假期影响,购买人数减少可适当降低库存.",523,140010042794,库存. 人数 建议 
Image14001004-2824.jpg,枝头上的滴水山花,524,140010042824,枝头上的滴水山花
Image14001004-3064.jpg,"二,师范类专业这个专业说,流行的是向人们销售产品,未来的工作方向",525,140010043064,工作方向 师范类专业 产品 
Image14001004-3101.jpg,中渝山顶道法式大独栋 富人聚居之地 商圈内闹中取静,526,140010043101,渝山顶 商圈 富人 
Image14001004-3123.jpg,五菱宏光mini ev首批用户交车 7月24日上市,527,140010043123,用户交车 ev 上市 
Image14001004-3262.jpg,发汗服跑步e服出汗降体服不透气 男h女服暴汗服控体服,528,140010043262,体服 男h女服暴汗服 汗服跑步e 
Image14001004-3343.jpg,聚焦项目看发展,529,140010043343,聚焦项目看发展
Image14001004-3388.jpg,"学会垃圾分类等形式树立健康的生活新观念,改变不良生活习惯!",530,140010043388,学会垃圾分类 生活新观念 不良生活习惯 
Image14001004-3417.jpg,碑贴拓片<人名>书法茅屋是吾居 真实碑拓装饰办公司客厅-收藏品,531,140010043417,真实碑 书法茅屋 装饰办公司客厅 
Image14001004-3489.jpg,本菲卡有望以租期两年800万转会费从国际米兰得到拉扎罗,532,140010043489,国际米兰 转会费 本菲卡 
Image14001004-3512.jpg,"林更新玩脱了!怼网友,比中指,说脏话,新剧评分暴跌至6.",533,140010043512,怼网友 新剧评分 脏话 
Image14001004-3629.jpg,新海诚《你的名字》桌面壁纸,534,140010043629,新海诚《你的名字》桌面壁纸
Image14001004-3754.jpg,"不过方向盘两侧有拨片可以调节动能回收力度,要注意的是,只有在踩下",535,140010043754,动能回收力度 方向盘 拨片 
Image14001004-3791.jpg,"工匠到家:地砖简单快速修复方法,让划痕和污渍再也不见!",536,140010043791,修复方法 划痕 地砖 
Image14001004-3882.jpg,"猪猪侠:吉丁为达到自己的目的,不择手段,关键时刻小猪猪给力!",537,140010043882,不择手段 关键时刻 吉丁 
Image14001004-3987.jpg,花园庭院家用灭蚊太阳能地插灯室外防水商用诱捕驱蚊,538,140010043987,防水商用诱捕 蚊太阳能地 花园庭院家用 
Image14001004-4028.jpg,"在一次偶然的情况下被星探发掘了,凭借着自己帅气的长相进入了娱乐圈",539,140010044028,娱乐圈 长相 星 
Image14001004-4091.jpg,"滁州的美融在这四道色彩中,悠游古今,四色成章.",540,140010044091,悠游古今 色彩 滁州 
Image14001004-4123.jpg,"那一年<人名>刚满40岁,从此,他便成了迪克牛仔.",541,140010044123,迪克牛仔. 
Image14001004-4135.jpg,"耳机连接后自动识别,无线连接状态下依然支持调节使用,界面简洁易懂",542,140010044135,无线连接状态 耳机 界面 
Image14001004-4177.jpg,"直接放尖椒烙用勺子逐个压一会儿,会听到水汽都出来的声音,烙至变软",543,140010044177,勺子 水汽 尖椒 
Image14001004-4269.jpg,突发国际空间站突然失控nasa准备上演太空大逃亡,544,140010044269,突发国际空间站突然失控nasa 
Image14001004-4270.jpg,随时待命的专业化妆师为你打造最cool,545,140010044270,专业化妆师 
Image14001004-4272.jpg,图解《喜爱夜蒲1》香港电影 夜场生活剧情,546,140010044272,喜爱夜蒲1 香港电影 生活剧情 蒲1 
Image14001004-4296.jpg,"平日里李氏和婆婆张氏相依为命,婆媳二人靠着编织衣服勉强维持生计.",547,140010044296,婆婆张氏 编织衣服 婆媳 
Image14001004-4311.jpg,"在暂停后杰伦-格林与工作人员一同回到了更衣室,不过他很快又回到了",548,140010044311,后杰伦-格林与工作人员 更衣室 
Image14001004-4374.jpg,4路时控光控回路开关智能照明模块经纬度路灯控制器,549,140010044374,纬度路灯控制器 时控光控回路开关智能照明模块 
Image14001004-4376.jpg,"这样过分的冷静甚至让喜欢的他的女嘉宾无所适从,不知道怎么才能打动",550,140010044376,女嘉宾 
Image14001004-4451.jpg,卡通人物和问号,551,140010044451,卡通人物和问号
Image14001004-4536.jpg,河南省温县蓝天救援队党员志愿者在居民小区进行消毒.,552,140010044536,居民小区 河南省温县蓝天救援队党员志愿者 消毒 
Image14001004-4658.jpg,能写这么漂亮的钢笔字.,553,140010044658,能写这么漂亮的钢笔字.
