image_id,caption,text_id,new_image_id,new_caption
Image14001002-1322.jpg,绿色建筑工程_江苏建设工程_装配式建筑公司-江苏建总,189,140010021322,绿色建筑工程 江苏建设工程 江苏建 
Image14001002-1377.jpg,"林逋,字君复,<人名>赐谥""和靖先生"".年少博学,通晓史籍.",190,140010021377,年少博学 字君复 史籍 
Image14001002-1525.jpg,芝加哥玛吉戴利城市公园景观设计 3,191,140010021525,芝加哥玛吉戴利城市公园景观设计 
Image14001002-1528.jpg,创新引领-科技强区,192,140010021528,创新引领-科技强区
Image14001002-1685.jpg,"大涨了20210721 周二简版: 朋友们,早上好.先回顾一下",193,140010021685,简版 朋友们 
Image14001002-1688.jpg,"考研资讯 天津师范大学艺术设计考研定向班火热招生中,该课程包含",194,140010021688,定向班火热招生 天津师范大学艺术设计 课程 
Image14001002-1722.jpg,标题:海岛朝霞,195,140010021722,标题:海岛朝霞
Image14001002-1729.jpg,"都美竹和其他受害者一开始有和解的打算,几个女孩都希望能回到平静",196,140010021729,受害者 和解 美竹 
Image14001002-1761.jpg,网易首页>网易号>正文申请入驻> 挥汗如雨的日与夜把直挂品貌缀,197,140010021761,网易首页 网易号 貌 
Image14001002-1830.jpg,"关注民生,关心教育,关爱学子,帮助困难家庭减轻子女上学经济负担",198,140010021830,困难家庭 经济负担 学子 
Image14001002-1888.jpg,"崇尚以趣味时尚的单品混搭不同造型,妆点不同心境,使众多追求时髦的",199,140010021888,趣味时尚 单品混搭不同造型 妆点不同心境 
Image14001002-1895.jpg,长安精选 | 泪目!这是两笔特殊的捐款……_拉齐尼,200,140010021895,泪目 _拉齐尼 捐款 
Image14001002-1944.jpg,传播沟通——公共关系学ppt,201,140010021944,传播沟通——公共关系学ppt
Image14001002-2110.jpg,"此外打篮球还可以锻炼人的心志,帮助人获得一种乐观的精神态度,积极",202,140010022110,精神态度 心志 篮球 
Image14001002-2131.jpg,"美国和日本原本已经有了矛盾,在陆军的一些作为后伤害到了美国的利益",203,140010022131,陆军 美国 日本 
Image14001002-2151.jpg,"供应绿加鲜冷冻腿排(量大优惠,价格可议)",204,140010022151,鲜冷冻腿 
Image14001002-2197.jpg,呵护眼睛从小做起手抄报模板及图片_保护眼睛手抄报,205,140010022197,手抄报模板 呵护眼睛 眼睛手抄报 
Image14001002-2224.jpg,看了一圈更懵逼了澳门人咋了发生啥了他俩不是感情很好的嘛,206,140010022224,澳门人 感情 
Image14001002-2240.jpg,"在仓库堆积如山等待打包的锅具价格便一下低了好几倍,国产中高端锅具",207,140010022240,锅具价格 高端锅具 仓库 
Image14001002-2278.jpg,新田名居3室2厅65㎡68万二手房图片,208,140010022278,二手房图片 厅65 室 
Image14001002-2306.jpg,美国参议院多数党领袖麦康奈尔和其妻赵小兰那些被诟病的利益冲突和,209,140010022306,妻赵小兰 党领袖麦康奈尔 美国参议院 
Image14001002-2384.jpg,商场同款糖力夏季新款红色小礼服高腰显瘦短袖连衣裙女砖红色xs,210,140010022384,款糖力 瘦短袖连衣裙女砖红色xs 新款红色小礼服高腰 
Image14001002-2538.jpg,圣骑士王 阿托利斯,211,140010022538,圣骑士王 阿托利斯
Image14001002-2729.jpg,中国航天科技集团公司第八研究院的航天产品,212,140010022729,中国航天科技集团公司 航天产品 研究院 
Image14001002-2786.jpg,不掌握绣球花的调蓝两个时间段也是枉然,213,140010022786,绣球花 时间段 
Image14001002-2961.jpg,<人名> 太湖小景,214,140010022961,<人名> 太湖小景
Image14001002-2987.jpg,"沈阳公布一项重要发展规划!未来去政府窗口办事,接待",215,140010022987,未来去政府 沈阳 重要发展规划 
Image14001002-3039.jpg,"国产新旗舰,极氪 zeekr 001对垒比亚迪汉,谁更胜一筹",216,140010023039,对垒比亚迪汉 国产新旗舰 氪 
Image14001002-3045.jpg,2021年成考报名流程及准考证打印,217,140010023045,成考报名流程 准考证 
Image14001002-3061.jpg,"虽然娜姐没有直说是哪个宝宝不爱吃饭,但是张杰在夫妻档综艺中有提到",218,140010023061,夫妻档综艺 张杰 宝宝 
Image14001002-3066.jpg,"雪姨2个女儿,梦萍只学到了她的尖酸刻薄,如萍却学到了",219,140010023066,尖酸刻薄 梦萍 如萍 
Image14001002-3127.jpg,"姚南仲为节度使,被监军薛盈珍依仗势力,篡夺了军政大权.",220,140010023127,监军薛盈珍 军政大权 姚南仲为节度 
Image14001002-3148.jpg,"秋越浓,婺源的颜色就越红,山顶上,山沟里,满山红叶竞相争艳.",221,140010023148,山红叶 婺源 山沟 
Image14001002-3164.jpg,dc部分设计了一个点烟器插座和两个dc5.5*2.,222,140010023164,点烟器插座 个dc5.5 
Image14001002-3214.jpg,"伴随着全体学员响亮有力的口号,整齐划一的步伐,新警们以斗志昂扬的",223,140010023214,新警们 伴随着全体学员 斗志 
Image14001002-3384.jpg,龙光玖龙台45000元/㎡,224,140010023384,龙光玖龙台45000元/㎡
Image14001002-3400.jpg,"画好同心圆,托起稳稳的幸福决战决胜高水平全面建成小康社会,就是要",225,140010023400,小康社会 好同心 高水平 
Image14001002-3437.jpg,欧盟ce认证-lvd_深圳市力质特科技有限公司,226,140010023437,质特科技有限公司 
Image14001002-3457.jpg,"""跑量""和""强度"",孰重孰轻?",227,140010023457,强度 量 
Image14001002-3525.jpg,我与良品铺子ceo<人名>,228,140010023525,我与良品铺子ceo<人名>
Image14001002-3528.jpg,"杨洋军装照,男明星的军装照,<人名>霸气,<人名>俊美",229,140010023528,男明星 杨洋军装照 霸气 
Image14001002-3562.jpg,"试验了黄衫女子;
",230,140010023562,"试验了黄衫女子;
"
Image14001002-3668.jpg,圣经历史概揽ppt_word文档在线阅读与下载_无忧文档,231,140010023668,忧文档 圣经历史概揽ppt_word文档在线 
Image14001002-3970.jpg,6万元私了.,232,140010023970,6万元私了.
Image14001002-4020.jpg,"一旦进灰,后期移除灰点再清洁感光元件就可以了.",233,140010024020,感光元件 进灰 灰点 
Image14001002-4022.jpg,"专家考察认为:不是人工制作的,也不是动物化石",234,140010024022,动物化石 专家 
Image14001002-4024.jpg,"德技新品窄边门窗:极简精致,引动潮流",235,140010024024,德技新品 简精致 门窗 
Image14001002-4060.jpg,"原来,狐妻在林中杀了不少恶狼,但心中还是忐忑不安,突然不放心将曲",236,140010024060,恶狼 将曲 狐妻 
Image14001002-4188.jpg,南宁有城市中轴线吗,237,140010024188,南宁有城市中轴线吗
Image14001002-4203.jpg,线描画精彩课堂(动物篇),238,140010024203,线描画精彩课堂(动物篇)
Image14001002-4252.jpg,"草原之门是文旅发展,精准扶贫,产业科创的现代农业综合性创新产业园",239,140010024252,精准扶贫 产业科创 草原之门 
Image14001002-4384.jpg,"东南大学""瑞<人名>""新生专项助学金发放完成,310名本科新生受助",240,140010024384,新生专项助学金 本科新生受助 瑞 
Image14001002-4493.jpg,"服用甲钴胺多久能停药其实并没有一个明确的期限,还是要根据自身情况",241,140010024493,药 甲钴胺 期限 
Image14001002-4581.jpg,doge狗狗币和他的2个小弟shib柴犬币akita秋田犬币,242,140010024581,doge狗狗币 秋田犬币 小弟shib 
Image14001002-4597.jpg,"首先要和装修工人沟通,测量设计橱柜的位置,尺寸.",243,140010024597,设计橱柜 装修工人 尺寸 
Image14001002-4678.jpg,"又一新项目将落户平潭!这次跟""智慧城市""有关.",244,140010024678,智慧城市 新项目 平潭 
Image14001002-4709.jpg,地缚少年花子君:司普宁的恋情,245,140010024709,地缚少年花子君:司普宁的恋情
Image14001002-4721.jpg,有些女性总感觉怀孕后易害热也和这有一定的关系.,246,140010024721,女性总感觉 热 关系 
Image14001002-4934.jpg,兴达花园不少违建棚厦破旧开裂,247,140010024934,兴达花园不少违建棚厦破旧开裂
Image14001002-4944.jpg,"除了上节目开怼,叶璇也在某站注册了一个账号.",248,140010024944,叶璇 怼 账号 
Image14001002-4955.jpg,"诊断:胃窦溃疡,萎缩性胃炎.",249,140010024955,"诊断:胃窦溃疡,萎缩性胃炎."
Image14001002-5001.jpg,"内强基本功,外拓新途径.",250,140010025001,"内强基本功,外拓新途径."
Image14001002-5012.jpg,"宝沃挑战""行业潜规则"" 杨嵩胜算几何?",251,140010025012,宝沃挑战 行业潜规则 杨嵩胜算几何 
Image14001002-5089.jpg,一种用于稳固基塘的消落带的制作方法,252,140010025089,制作方法 基塘 消落带 
Image14001002-5095.jpg,"阿富汗部队溃不成军,越境逃入巴基斯坦避难,喀布尔不",253,140010025095,阿富汗部队 逃入巴基斯坦避难 成军 
Image14001002-5259.jpg,"早上吃还是晚上吃,饭前还是饭后? 可以用牛奶或者茶水送服吗?",254,140010025259,牛奶 茶水 
Image14001002-5300.jpg,周强简要介绍了中国知识产权司法保护有关情况.,255,140010025300,中国知识产权司法保护有关情况 周强 
Image14001002-5380.jpg,东野圭吾最刺痛人心的代表作——《虚无的十字架》,256,140010025380,虚无的十字架 刺痛人心 十字架 代表作 
Image14001002-5482.jpg,人居环境整治!苏家坨镇西埠头村拆除私搭乱建1700余平米,257,140010025482,苏家坨镇西埠头村 人居环境整治 
Image14001002-5495.jpg,当代歌坛0133月末版 古巨基 那英封面 f4 <人名> <人名>,258,140010025495,古巨基 那英封面 f4 
Image14001002-5604.jpg,南宁地铁3号线站点名 南宁地铁三号线途经站点,259,140010025604,南宁地铁 线站点名 站点 
Image14001002-5634.jpg,表1:有关政策落实事项及任务分工,260,140010025634,任务分工 有关政策落实事项 表 
Image14001002-5747.jpg,"丰田凯美瑞对比日产天籁,20万级日系合资中型车怎么选",261,140010025747,丰田凯美瑞对比日产天籁 级日系合资中型车 
Image14001002-5808.jpg,"很多的坟前,竟然种着青竹.",262,140010025808,"很多的坟前,竟然种着青竹."
Image14001002-5817.jpg,"
朝日啤酒所倡导的理念——""激发好奇心去探索"".",263,140010025817,"朝日啤酒 
 好奇心 "
Image14001002-5852.jpg,helius/赫丽尔斯玫瑰安瓶原液 精华液 深层补水锁水,264,140010025852,精华液 赫丽尔斯玫瑰安瓶原液 helius 
Image14001002-5894.jpg,(为什么总提这颗卫星?,265,140010025894,(为什么总提这颗卫星?
Image14001002-5974.jpg,"张师傅的这道石林黄焖驴肉,特意选择的是位于驴腹部的驴腩肉.",266,140010025974,驴腩肉 驴腹部 张师傅 
Image14001002-5979.jpg,"还有作为家用到底值不值得购买等等,下面红涛就来说说宝来传奇的各",267,140010025979,宝来传奇 家用到底 红涛 
Image14001002-6129.jpg,"经受不住打击的她卧床不起,她还表示,自己和丈夫曾多次想去看望姚策",268,140010026129,姚策 丈夫 
Image14001002-6156.jpg,"放弃后容易暴饮暴食,往往适得其反,体重不减反增.",269,140010026156,适得其反 增. 体重 
Image14001002-6258.jpg,红灯纪,270,140010026258,红灯纪
Image14001002-6363.jpg,"这场品牌年轻节的盛会,尽显品牌大咖论年轻,青年互动聚活力的风采",271,140010026363,品牌年轻节 品牌大咖论 盛会 
Image14001002-6364.jpg,"一起出去约会时,李柄熹还会喂<人名>吃东西,非常贴心.",272,140010026364,李柄熹 东西 
Image14001002-6372.jpg,纯手工拼花木地板厂家直销特价 艺术拼花实木多层复合地板,273,140010026372,复合地板 艺术拼花实木多 花木地板厂家 
Image14001002-6389.jpg,这些日子五莲气温如过山车般,274,140010026389,这些日子五莲气温如过山车般
Image14001002-6438.jpg,"最牛股票已11涨停,半年报预告扭亏",275,140010026438,牛股票 年报 
Image14001002-6500.jpg,"一定不容错过的黑米面包,好吃到想哭._腾讯网",276,140010026500,黑米面包 腾讯网 
Image14001002-6502.jpg,"一二线城市二手房挂牌量激增,市场在抛售?",277,140010026502,二线城市二手房挂牌量 市场 
Image14001002-6598.jpg,他们差点结束了印小天的演员生涯.,278,140010026598,演员生涯 
Image14001002-6612.jpg,如何评价毛不易在《我是唱作人》第四期中的《呓语》?,279,140010026612,我是唱作人 呓语 唱作人 毛 
Image14001002-6647.jpg,"清肺利咽,除瘟止嗽.",280,140010026647,"清肺利咽,除瘟止嗽."
Image14001002-6682.jpg,卿之说幽默话做幽默人口服才能心服这样说话让人舒服口才训练书籍,281,140010026682,幽默话 人舒服口才训练书籍 幽默人口服 
Image14001002-6690.jpg,"但又看着怀里活泼可爱的儿子,我只能默默流眼泪……我特别想离开但又",282,140010026690,儿子 眼泪 
Image14001002-6731.jpg,"(图为已在百数落地的某某平台二手车贷款业务审批流程图)综上,百数",283,140010026731,
Image14001002-6744.jpg,"它的屏幕采用新一代全贴合工艺的聚合物液晶屏,一方面全贴合工艺可以",284,140010026744,聚合物液晶屏 全贴合工艺 屏幕 
Image14001002-6762.jpg,学生作品 8层住宅楼建筑给排水设计,285,140010026762,住宅楼建筑 排水设计 学生作品 
Image14001002-6962.jpg,京中铭记-奥林匹克公园&森林公园,286,140010026962,奥林匹克公园 森林公园 京 
Image14001002-6988.jpg,"安兔兔实际跑分达到了71万之多,这跟骁龙888其实非常接近了.",287,140010026988,骁龙 
Image14001002-7070.jpg,"爆肚它像锅贴一样需要油煎,外皮金黄酥脆,里面有不同的馅料,传统的",288,140010027070,馅料 外皮 锅贴 
Image14001002-7133.jpg,"我国在太原卫星发射中心用""长征四号丙""运载火箭成功发射""遥感卫星",289,140010027133,太原卫星发射中心 遥感卫星 长征四号丙 
Image14001002-7162.jpg,"一场大雨造成部分道路积水严重,给过往车辆和行人带来安全隐患",290,140010027162,过往车辆 道路积水 安全隐患 
Image14001002-7214.jpg,"因为吸烟会导致进入体内的有害物质增多,导致血管收缩,痉挛,并增加",291,140010027214,有害物质 血管 
Image14001002-7237.jpg,青春大学生们躺在草地上休息,292,140010027237,青春大学生们躺在草地上休息
Image14001002-7342.jpg,围墙喷雾除尘防尘喷头花洒雾化水器,293,140010027342,围墙喷雾 防尘喷头花洒 水器 
Image14001002-7359.jpg,"《大明风华》中朱棣下线,你有什么想说的?",294,140010027359,大明风华 下线 
Image14001002-7371.jpg,非洲大象行为粗暴闯入黑斑羚群欲独霸水塘,295,140010027371,黑斑羚群 非洲大象行为 水塘 
Image14001002-7398.jpg,道路限高架 智能液压升降限高杆 手机远程遥控简易限,296,140010027398,智能液压升降 手机远程遥控 高架 
Image14001002-7498.jpg,鸿业远图珠宝玉器:还是恒生电子是大哥大,297,140010027498,恒生电子 鸿业远图珠宝玉器 大哥大 
Image14001002-7622.jpg,"吕布以勇武出名,魏国在战国初期也最先强盛.",298,140010027622,吕布 魏国 出名 
Image14001002-7628.jpg,sig 556 ——〖枪炮世界〗,299,140010027628,sig 
Image14001002-7812.jpg,笔墨神韵显风骨慈悲宏愿为众生,300,140010027812,笔墨神韵显风骨慈悲宏愿为众生
Image14001002-7824.jpg,恭喜恭喜高要呢条村新增一国家3a级旅游景区你去过吗,301,140010027824,a级旅游景区 村 国家 
Image14001002-8001.jpg,"一篇文章,引发了港股和a股游戏公司股价的集体下跌",302,140010028001,a股游戏公司股价 港股 文章 
Image14001002-8042.jpg,"""七勇士""成员之佟连捷,<人名>,徐虹祭拜<人名>元帅",303,140010028042,佟连捷 勇士 徐虹 
Image14001002-8112.jpg,"提示:语音播报:""前方路口左转弯""后,打左转向灯,点刹.",304,140010028112,转向灯 路口 语音 
Image14001002-8139.jpg,"打遍三巨头,狠起来连自己都打!灭霸算",305,140010028139,霸 巨头 
Image14001002-8177.jpg,"陇西人的正月十五是这个样子的,人山人海,陇西人转起来",306,140010028177,人海 样子 人 
Image14001002-8278.jpg,延庆博物馆,307,140010028278,延庆博物馆
Image14001002-8285.jpg,"如果此图片与房源无关或模糊不清,请点击举报图片 尚景天地内景图",308,140010028285,尚景天地内景图 房源 图片 
Image14001002-8295.jpg,内蒙古知名敖包——高正胡热呼敖包祭祀活动暨首届青少年那达慕在,309,140010028295,内蒙古知名敖包 敖包祭祀活动 青少年 
Image14001002-8321.jpg,"宅男女神<人名>""龙袍""站台 大秀最炫民族风",310,140010028321,宅男女神 民族风 大秀 
Image14001002-8356.jpg,2021少女心炸裂的神仙颜值头像,311,140010028356,少女心 神仙颜值头像 
Image14001002-8392.jpg,女款水墨灰镂空双层领羊绒衫,312,140010028392,女款水墨灰镂空双层领羊绒衫
Image14001002-8426.jpg,"""济南蓝""刷爆朋友圈,随手一拍就是艺术大片!网红",313,140010028426,朋友圈 艺术大片 网红 
Image14001002-8427.jpg,"但在保修期上就不算十分慷慨了,仅是刚符合了国家标准而已.",314,140010028427,国家标准 保修期 
Image14001002-8559.jpg,儿童玩具车大号惯性恐龙工程车运输挖土挖掘机小汽车套装宝宝男孩真,315,140010028559,儿童玩具车大号惯性恐龙工程车运输 土挖掘机小汽车套装宝宝男孩 
Image14001002-8645.jpg,接吻会染上口腔尖锐湿疣吗?,316,140010028645,接吻会染上口腔尖锐湿疣吗?
Image14001002-8748.jpg,省民政厅涉外婚姻登记处:0551-65606091.,317,140010028748,婚姻登记处 省民政厅 
Image14001002-8771.jpg,正邮 付方剂学用速记 经方大家付教授的方剂学学用书,318,140010028771,付教授 方剂 正邮 
Image14001002-8925.jpg,【慕容游记】承德避暑山庄及外八庙(578图),319,140010028925,慕容游记 承德避暑山庄 庙 
Image14001002-8935.jpg,氧化剂,320,140010028935,氧化剂
Image14001002-8957.jpg,新一期拍拍贷3个公众号刮刮卡抽1-200元微信红包奖励,321,140010028957,公众号 微信红包奖励 拍拍贷 
Image14001002-8993.jpg,"国网河南省电力公司紧急启动i级防汛应急响应,全面进入战时机制.",322,140010028993,国网河南省电力公司 i级防汛应急响应 机制 
Image14001002-9051.jpg,听菩萨说悔火亦灸燃吾心必痛苦,323,140010029051,听菩萨说悔火亦灸燃吾心必痛苦
Image14001002-9085.jpg,"《复联3》曝光全新概念设计图,雷神风暴战斧展炫酷神威",324,140010029085,复联3 斧展炫酷神威 全新概念设计图 复联 风暴 
Image14001002-9149.jpg,"""新作《天下无拐》是《失孤》最好的结局在电影《天下无拐》导演张鑫",325,140010029149,天下无拐 失孤 天下无拐 导演张鑫 新作 电影 
Image14001002-9160.jpg,只因妻子拒绝出钱给小叔买房凤凰男以离婚相要挟结果弄巧成拙,326,140010029160,小叔 妻子 凤凰 
Image14001002-9224.jpg,"原创胎宝每天在妈妈腹中""小黑屋""里做啥,看了就让人欢喜,怪可爱的",327,140010029224,原创胎宝 小黑屋 妈妈 
Image14001002-9237.jpg,"如果去俄罗斯留学顺利完成了学业,毕业后可以留着俄罗斯工作吗?",328,140010029237,俄罗斯工作 学业 
Image14001002-9517.jpg,【图解图片_徐州润和传祺gs8图片】-汽车之家,329,140010029517,图解图片_徐州润和传祺gs8图片 传祺gs8图片 徐州 汽车 家 
Image14001002-9518.jpg,"3月第三批共53款版号:腾讯完美巨人在列,2款国产ns游戏过审",330,140010029518,国产ns游戏 腾讯完美巨人 审 
Image14001002-9572.jpg,"从全网吐槽到c位出道, <人名>""锦鲤人设""是这样来的",331,140010029572,锦鲤人 c 全网 
Image14001002-9592.jpg,"切实做到心有所畏,言有所戒,行有所止,模范遵守各项纪律规矩.",332,140010029592,纪律规矩 所止 模范 
Image14001002-9810.jpg,公交出行提示涉及通州区13条线路部分站名更名北京胸科医院,333,140010029810,北京胸科医院 线路部分站名 通州区 
Image14001002-9909.jpg,"瑜伽裤搭配黄色牛仔外套是蛮有型,宽松款的瑜伽裤很拉风,显瘦无敌",334,140010029909,瑜伽裤 黄色牛仔外套 宽松款 
Image14001003-0003.jpg,中国空军首批双学士歼击机女飞行员步入战位,335,140010030003,学士歼击机女飞行员 中国空军 战 
Image14001003-0028.jpg,全程工作人员费用及补贴,336,140010030028,全程工作人员费用及补贴
Image14001003-0387.jpg,"主卧阳台隔开放书桌与吊柜加梳妆镜,即可作为办公桌也可作为梳妆台",337,140010030387,主卧阳台 吊柜 梳妆台 
Image14001003-0485.jpg,"8月份遇贵人赏识,终于熬出头,不再委曲求全的星座",338,140010030485,星座 贵人 出头 
Image14001003-0516.jpg,"1,让狗来找你.",339,140010030516,"1,让狗来找你."
Image14001003-0659.jpg,风光摄影-39 云开雾散>,340,140010030659,风光摄影-39 云开雾散>
Image14001003-0714.jpg,"87 著名导演,编剧,演员李珈西《表演",341,140010030714,演员李珈西 著名导演 编剧 
Image14001003-0773.jpg,案例赏析 轻工业风格,342,140010030773,案例赏析 轻工业风格
Image14001003-0830.jpg,现代灰色拼接瓷砖贴图图片_3d模型_贴图id:46917,343,140010030830,图图片_3d模型 瓷砖 图id 
Image14001003-0837.jpg,七年前轰动一时的爷孙恋现状如何少女脸上写满了憔悴,344,140010030837,少女脸 爷 现状 
Image14001003-0985.jpg,《粉尘爆炸隔爆系统应用指南》规范了粉尘爆炸隔爆系统的应用设计和,345,140010030985,粉尘爆炸隔爆系统应用指南 粉尘爆炸 爆系统应用指南 应用设计 爆系统 
Image14001003-0988.jpg,值友故事会篇五宜家卧底两天我回家做了个电视柜,346,140010030988,电视柜 值友故事 卧底 
Image14001003-1017.jpg,"行,我一会给你送过去.",347,140010031017,"行,我一会给你送过去."
Image14001003-1056.jpg,"静态数据游戏玩家优选,每升一级都有1块上下收益,邀请人收益高些.",348,140010031056,静态数据游戏玩家 上下收益 人收益 
Image14001003-1063.jpg,是直接针对消防用水水源来说的么,349,140010031063,消防用水水源 
Image14001003-1086.jpg,"众所周知,奥运会的官方赞助商向奥组委支付了巨额赞助费,以期在这个",350,140010031086,巨额赞助费 官方赞助商 奥组委 
Image14001003-1098.jpg,黑龙滩长岛天堂洲际酒店客房图片,351,140010031098,黑龙滩长岛天堂洲际酒店客房图片 
Image14001003-1175.jpg,【中山保利天汇二期左岸花园】_楼盘详情-官方售楼,352,140010031175,中山保利天汇二期左岸花园 楼盘详情 中山保利天汇 花园 楼 官方 
Image14001003-1204.jpg,"克服各种阻挠成立业委会之后,第二次业主大会(第一次是成立大会)就",353,140010031204,业主大会 业委会 
Image14001003-1205.jpg,【图解图片_上海金悦汽车锋范图片】-汽车之家,354,140010031205,图解图片_上海金悦汽车锋范图片 上海金悦汽车锋范图片 家 汽车 
Image14001003-1322.jpg,"早在公元254年的时候,阮籍的母亲去世,许多人都去吊唁.",355,140010031322,公元 阮籍 母亲 
Image14001003-1384.jpg,哈尔滨儿童医院就医的那些事在这!,356,140010031384,哈尔滨儿童医院 事 
Image14001003-1413.jpg,深圳双溪威机场大酒店,357,140010031413,深圳双溪威机场大酒店
Image14001003-1464.jpg,"其中,绿城金沙湖项目已经公布案名——湖上春风里,入市指日可待.",358,140010031464,市指日 金沙湖项目 春风 
Image14001003-1492.jpg,旅游 正文  安昌是一个具有千年历史的著名江南水乡古镇.,359,140010031492,著名江南水乡古镇 安昌 旅游 
Image14001003-1582.jpg,你一味的付出不过是惯出来的得寸进尺,360,140010031582,付出 
Image14001003-1827.jpg,"""<人名>""<人名>会穿,粉白色衣服配黑色铅笔裤,穿出好气色!",361,140010031827,黑色铅笔裤 好气色 粉白色衣服 
Image14001003-1848.jpg,湖人队告别多名球员球队换血成功佩林卡得到詹姆斯认可,362,140010031848,成功佩林 球员球队 湖人队 
Image14001003-1850.jpg,"但前者更厚实的底盘调校,可以带来更好的乘坐舒适性,总的来说,除了",363,140010031850,底盘调校 乘坐舒适性 
Image14001003-1868.jpg,"松懈了几天,要补回公里数",364,140010031868,"松懈了几天,要补回公里数"
Image14001003-1912.jpg,为什么每个啤酒瓶盖上都是21个锯齿?原来是因为这样,365,140010031912,啤酒瓶盖 锯齿 
Image14001003-1972.jpg,济南制做11火车列车餐车步行街铁皮复古火车商场步行,366,140010031972,火车商场 火车列车餐车步行街铁皮 济南 
Image14001003-1975.jpg,"然而,奔忙可不是行为可以随意,言辞可以散漫的借口呢.",367,140010031975,言辞 借口 行为 
Image14001003-1999.jpg,市场营销股票金融投资理财 巴菲特瑞达利欧查理芒格推崇的价值投资力,368,140010031999,巴菲特瑞达利欧查理 市场营销股票金融投资 价值投资力 
Image14001003-2080.jpg,王源如何与阿拉甲主播携手改写命运,369,140010032080,阿拉甲主播 王源 命运 
Image14001003-2098.jpg,"曾打破鲁尼纪录,英超官宣",370,140010032098,"曾打破鲁尼纪录,英超官宣"
Image14001003-2124.jpg,钓椅包特大双肩背包工具包渔具包钓鱼背包鱼具垂钓包鱼护包,371,140010032124,特大双肩背包工具 垂钓包鱼 钓鱼背包鱼 
Image14001003-2284.jpg,沈阳多处建筑工地遇招不来年轻人尴尬,372,140010032284,建筑工地 沈阳 年轻人 
Image14001003-2286.jpg,"投票后即可看到截止目前的结果,可以说玩家的选择是一边倒的.",373,140010032286,玩家 投票 选择 
